Recipe title,Subheading,Image (link),Recipe-detail serves,Recipe-detail time,Recipe-detail,Calories,Fat,Saturates,Sugars,Salt,Protein,Carbs,Fibre,Ingred-list,RecipeSteps
Beef stifado recipe | Jamie Oliver recipes,"Red wine, garlic, spices & herbs","https://img.jamieoliver.com/jamieoliver/recipe-database/46259151.jpg?tr=w-800,h-1066","['Serves', '4']",marinading time,"“In Greece, stifado is served with hilopittes (egg pasta) or orzo (rice-shaped grains of pasta). Once you've tried this a few times and become addicted to its intense flavours, you can try swapping the beef for veal or rabbit. ”",660,25.8g,7.2g,11.8g,1.3g,87.6g,15.2g,4g,"1.5                                                                                                                                                                kg                                                                                                                                                                stewing beef, such as chuck or top rump                                                                                                                                                                , trimmed, cut into 7cm pieces, 24                                                                                                                                                                                                                    baby onions, 4                                                                                                                                                                                                                    ripe tomatoes                                                                                                                                                                , or 1 x 400g tin of chopped tomatoes, 4                                                                                                                                                                tablespoons                                                                                                                                                                extra virgin olive oil, 1                                                                                                                                                                tablespoon                                                                                                                                                                tomato purée, MARINADE, 3                                                                                                                                                                cloves of                                                                                                                                                                garlic, 2-3                                                                                                                                                                                                                    fresh bay leaves, 1½                                                                                                                                                                teaspoons                                                                                                                                                                allspice berries, 6                                                                                                                                                                                                                    whole cloves, 1-2                                                                                                                                                                sticks of                                                                                                                                                                cinnamon, 1                                                                                                                                                                teaspoon                                                                                                                                                                dried oregano, 125                                                                                                                                                                ml                                                                                                                                                                dry red wine, 4                                                                                                                                                                tablespoons                                                                                                                                                                red wine vinegar","Place the beef in a large non-reactive bowl. Add the marinade ingredients, peeling and finely slicing the garlic first, then cover and refrigerate for at least 6 hours, or preferably overnight., Peel the baby onions. If using fresh, peel and roughly chop the tomatoes., Heat the oil over medium heat in a large saucepan and sauté the onions for 5 minutes or until softened. Remove with a slotted spoon and set aside., Sauté the beef, reserving the marinade, for about 8 to 10 minutes, or until browned on all sides., Return the onions to the saucepan, add the marinade, tomatoes and tomato purée and enough water to just cover the stew., Season generously with sea salt and freshly ground black pepper. Bring to the boil then simmer for 1½ to 2 hours, or until the beef is tender and the sauce has thickened., Serve with pasta and grated hard cheese, such as kefalotiri, pecorino or Parmesan."
Chianti Crudo | Beef Recipes | Jamie Oliver,"Raw tender beef with chilli, parsley & lemon","https://img.jamieoliver.com/jamieoliver/recipe-database/46257783.jpg?tr=w-800,h-1066","['a', 'starter']",In10 minutes,"“This is one of Dario’s signature dishes, and takes its name from the Tuscan wine region. You’ll be eating the meat raw, or close to, so buy the best quality you can. ”",226,13.3g,3.1g,0.2g,0.3g,38.6g,0.7g,0.1g,"1                                                                                                                                                                kg                                                                                                                                                                topside of quality beef, 1                                                                                                                                                                large                                                                                                                                                                clove of garlic, ½                                                                                                                                                                a bunch of                                                                                                                                                                fresh flat-leaf parsley, 1                                                                                                                                                                                                                    lemon, 1                                                                                                                                                                teaspoon                                                                                                                                                                dried chilli flakes, 4                                                                                                                                                                tablespoons                                                                                                                                                                olive oil","Bring the meat to room temperature, then place it on a board and tenderise with a meat hammer or Jaccard-style tenderiser., Cut the meat into large chunks and transfer to a large bowl. Season to taste., Peel, finely chop and add the garlic. Pick, chop and add the parsley, then add the lemon zest and juice, the chilli and oil. Adjust the quantities to taste; there should be just a hint of each, to bring out the meat’s best aspects and not mask its flavour., Transfer to a platter and serve immediately with ciabatta-style bread."
Easy beef taco recipe | Jamie magazine taco recipes,Fresh tomato salsa & guacamole,"https://img.jamieoliver.com/jamieoliver/recipe-database/46264674.jpg?tr=w-800,h-1066","['Serves', '6']",In1 hour,"“Tacos are crunchy, messy and great fun to eat, so it’s no wonder they’re a big hit with the kids. They’re also easy to make – more of an assembly job than a recipe.  ”",447,29.8g,11.1g,5.1g,0.9g,21.8g,23.1g,1.8g,"1                                                                                                                                                                                                                    onion, 1                                                                                                                                                                                                                    red pepper, 1                                                                                                                                                                                                                    green pepper, olive oil, 2                                                                                                                                                                cloves of                                                                                                                                                                garlic, 1                                                                                                                                                                pinch of                                                                                                                                                                paprika, 1½                                                                                                                                                                teaspoons                                                                                                                                                                cumin, 500                                                                                                                                                                g                                                                                                                                                                quality minced beef, 250                                                                                                                                                                ml                                                                                                                                                                organic beef stock, 12                                                                                                                                                                                                                    corn taco shells, SALSA, 2                                                                                                                                                                                                                    ripe tomatoes, 1                                                                                                                                                                                                                    spring onion, 3                                                                                                                                                                sprigs of                                                                                                                                                                fresh coriander, ½                                                                                                                                                                a                                                                                                                                                                lime, GUACAMOLE, 2                                                                                                                                                                                                                    ripe avocados, ½                                                                                                                                                                                                                    lime, 2                                                                                                                                                                tablespoons                                                                                                                                                                crème fraîche","Peel and dice the onion, then deseed and dice the peppers. Soften in 1 tablespoon of oil in a large pan over a low heat., Peel, finely slice and add the garlic, along with the paprika and cumin, and cook for 1 to 2 minutes. Add the beef and stir until it has browned., Pour in the stock, cover, and cook for 45 minutes, or until reduced and delicious., Preheat the oven to 180ºC/350ºF/gas 4., For the salsa, roughly chop the tomatoes, trim and finely slice the spring onion, then pick and roughly chop the coriander leaves. Combine with the lime juice, then season carefully to taste., For the guacamole, halve and destone the avocados, then mash the flesh with a fork. Squeeze in the lime juice, add the crème fraîche, season, and gently mix it all up., Spread the taco shells out on a baking tray and place in the oven for 3 to 4 minutes until crisp., Fill the shells with the meat, salsa and guacamole or lay everything out and let everyone help themselves."
Easy beef stroganoff recipe | Jamie Oliver beef recipes,,"https://img.jamieoliver.com/jamieoliver/recipe-database/CvIMUolmqvGBWz-Ljp7Wfg.jpg?tr=w-800,h-1066","['Serves', '4']",In25 minutes,,344,16.4g,7.9g,3.1g,0.7g,27.8g,4g,1.4g,"1                                                                                                                                                                                                                    red onion, 1                                                                                                                                                                clove of                                                                                                                                                                garlic, 1                                                                                                                                                                                                                    lemon, 2                                                                                                                                                                handfuls of                                                                                                                                                                wild mushrooms, 2-3                                                                                                                                                                sprigs of                                                                                                                                                                fresh flat-leaf parsley, 500                                                                                                                                                                g                                                                                                                                                                fillet steak, 1                                                                                                                                                                teaspoon                                                                                                                                                                paprika, olive oil, 1                                                                                                                                                                knob of                                                                                                                                                                unsalted butter, 1                                                                                                                                                                small glass of                                                                                                                                                                brandy, 50                                                                                                                                                                ml                                                                                                                                                                sour cream","Peel and finely chop the onion and garlic, then finely grate the lemon zest. Clean and tear the mushrooms. Pick and finely chop the parsley., Place the beef between 2 sheets of clingfilm. Bash with a rolling pin until ½ cm thick, then cut into finger-width slices., Mix the paprika, lemon zest, and a pinch of sea salt and black pepper together, and use to dust the beef., In a large frying pan over a medium-low heat, fry the onion and garlic in a little oil until softened. Turn up the heat and add the mushrooms and butter, sautéing until the mushrooms are golden brown, then tip onto a plate

Add a little oil to the pan and fry the beef for 2 minutes, turning, until browned but still pink inside. Stir in the mushroom-onion mixture, add the brandy and reduce for 1 minute or until almost disappeared.

Remove from the heat and stir in the cream and parsley. Delicious serve with bread and gherkins."
Jamie's flash steak | Beef recipes | Jamie Oliver recipes,With salsa picante,"https://img.jamieoliver.com/jamieoliver/recipe-database/46259095.jpg?tr=w-800,h-1066","['Serves', '4']",In30 minutes,,593,40.9g,15.1g,0.1g,2.4g,55.9g,0.8g,0g,"4                                                                                                                                                                                                                     feather steaks, 16                                                                                                                                                                                                                    fresh sage leaves, 12                                                                                                                                                                 slices of                                                                                                                                                                prosciutto, a few                                                                                                                                                                 sprigs of                                                                                                                                                                 fresh soft herbs                                                                                                                                                                , such as parsley, extra virgin olive oil, 1                                                                                                                                                                                                                    lemon, SALSA PICANTE, 12                                                                                                                                                                                                                     ripe cherry tomatoes                                                                                                                                                                , mixed colours if possible, 6                                                                                                                                                                                                                    ripe baby plum tomatoes, 6                                                                                                                                                                                                                    ripe plum tomatoes, ½                                                                                                                                                                a bunch of                                                                                                                                                                fresh basil, 2                                                                                                                                                                cloves of                                                                                                                                                                garlic, 80                                                                                                                                                                ml                                                                                                                                                                extra virgin olive oil, ½                                                                                                                                                                                                                    lemon","To make the salsa, quarter the cherry and baby plum tomatoes. Deseed the larger plum tomatoes, then cut into strips. Pick and slice the basil leaves, then peel and finely slice the garlic., Place into a bowl with the oil and lemon juice, toss well, then season to taste with sea salt and black pepper., Place the steaks on a board and season with salt and pepper. Lay 4 sage leaves on each steak, then cover each with 3 slices of prosciutto., Take a meat hammer and pummel the steaks so that the prosciutto sticks to them, then lightly oil., Get a griddle pan really hot, then add the steaks and cook to your liking, turning frequently., Allow the steaks to rest for 5 minutes, then serve with the salsa picante, the chopped herb leaves and dressed with a little olive oil, lemon juice, salt and pepper."
