Recipe title,Subheading,Image (link),Recipe-detail serves,Recipe-detail time,Recipe-detail,Calories,Fat,Saturates,Sugars,Salt,Protein,Carbs,Fibre,Ingred-list,RecipeSteps
Beef short ribs recipe | Jamie Oliver recipes,With crunchy winter slaw,"https://img.jamieoliver.com/jamieoliver/recipe-database/oldImages/large/1362_15_1434019347.jpg?tr=w-800,h-1066","['Serves', '6']",15 minutes,"“Sticky and delicious, these tender beef short ribs are well worth the wait. ”",621,41.6g,15.9g,24.2g,2.4g,36.7g,25.5g,1.4g,"2 x 1.5                                                                                                                                                                kg                                                                                                                                                                 beef short ribs, olive oil, 2                                                                                                                                                                teaspoons                                                                                                                                                                caraway seeds, 1                                                                                                                                                                bunch of                                                                                                                                                                fresh dill, 2                                                                                                                                                                                                                    pickled onions                                                                                                                                                                , in vinegar, 2                                                                                                                                                                tablespoons                                                                                                                                                                Hellmann's Real Mayonnaise, 2                                                                                                                                                                tablespoons                                                                                                                                                                low-fat natural yoghurt, 2                                                                                                                                                                teaspoons                                                                                                                                                                English mustard, 1½                                                                                                                                                                tablespoons                                                                                                                                                                white wine vinegar, 1                                                                                                                                                                medium                                                                                                                                                                yellow beetroot                                                                                                                                                                , with leaves, 6                                                                                                                                                                medium                                                                                                                                                                carrots, ¼ of a                                                                                                                                                                white                                                                                                                                                                cabbage, 300                                                                                                                                                                g                                                                                                                                                                kale                                                                                                                                                                , green and purple, if possible, BBQ SAUCE, 180                                                                                                                                                                ml                                                                                                                                                                tomato ketchup, 150                                                                                                                                                                ml                                                                                                                                                                stout, 4                                                                                                                                                                tablespoons                                                                                                                                                                Worcestershire sauce, 1                                                                                                                                                                heaped teaspoon                                                                                                                                                                English mustard, 4                                                                                                                                                                teaspoons                                                                                                                                                                 malt vinegar, 4                                                                                                                                                                teaspoons                                                                                                                                                                golden syrup","Preheat the oven to 100ºC/212ºF/gas ¼., Place the ribs in a snug-fitting roasting tray, season with sea salt and black pepper, drizzle with oil, then rub all over. Cover tightly with a double layer of tin foil, then cook for 7 to 8 hours, or until tender., When the time’s up, transfer the ribs to a baking tray. Skim away the fat from the roasting tray and reserve in an airtight jar (use it for delicious roast potatoes another day)., Place the roasting tray over a high heat on the hob and bring the juices to the boil. Simmer for around 2 minutes, then add the remaining sauce ingredients. Bring back to the boil, then reduce the heat to low and simmer for a further 10 minutes, or until the sauce has thickened and coats the back of a spoon., Brush most of the sauce onto the ribs so they’re nicely coated all over, then return the ribs to the oven for 20 to 40 minutes, or until sticky and caramelised to your liking., Meanwhile, place a small frying pan over a medium heat. Add the caraway seeds and toast for around 1 minute, or until smelling fantastic. Tip into a large bowl., Finely chop the dill and pickled onions, then add to the bowl with the mayo, yoghurt, mustard, white wine vinegar and a splash of the pickled onion vinegar. Whisk well to combine., Remove the beetroot leaves and set aside. Scrub and trim the beetroot and carrots, then pass all the vegetables and the beetroot leaves through the fine slicing attachment in a food processor. Add to the dressing, toss and scrunch everything together, then season to taste., Transfer the ribs to a chopping board, then carve up and serve with the winter slaw, remaining BBQ sauce and creamy mashed potato, if you like."
Winter nights chilli recipe | Jamie Oliver recipes,Topped with apple & red onion salsa,"https://img.jamieoliver.com/jamieoliver/recipe-database/oldImages/large/1315_1_1436963859.jpg?tr=w-800,h-1066","['Serves', '12']",In6 hours,"“When the weather’s closing in, it’s really great to tuck into a full flavoured, hearty dish and, for me, a proper, rustic chilli rocks. The meat will fall apart and melt in your mouth. It’s moreish and spicy with a clever contrasting salsa. ”",553,28.5g,9.5g,19.9g,0.9g,40.4g,35.8g,7.3g,"20                                                                                                                                                                g                                                                                                                                                                dried porcini mushrooms, 2                                                                                                                                                                tablespoons                                                                                                                                                                fennel seeds, 2                                                                                                                                                                tablespoons                                                                                                                                                                coriander seeds, 2                                                                                                                                                                tablespoons                                                                                                                                                                smoked paprika, 1                                                                                                                                                                                                                    butternut squash                                                                                                                                                                , (1.2kg), olive oil, 1                                                                                                                                                                kg                                                                                                                                                                higher-welfare pork belly                                                                                                                                                                , skin off, bone out, 1                                                                                                                                                                kg                                                                                                                                                                brisket, 2                                                                                                                                                                large                                                                                                                                                                onions, 150                                                                                                                                                                ml                                                                                                                                                                balsamic vinegar, 2 x 400                                                                                                                                                                g tins of                                                                                                                                                                 cannellini beans                                                                                                                                                                , or chickpeas, 2 x 400                                                                                                                                                                g tins of                                                                                                                                                                quality plum tomatoes, 4                                                                                                                                                                                                                    mixed-colour peppers, 2–3                                                                                                                                                                                                                    fresh red chillies, 1                                                                                                                                                                bunch of                                                                                                                                                                fresh coriander                                                                                                                                                                , (30g), SALSA, 1                                                                                                                                                                                                                    red onion, 2                                                                                                                                                                                                                    eating apples, 3                                                                                                                                                                tablespoons                                                                                                                                                                cider vinegar, 3                                                                                                                                                                tablespoons                                                                                                                                                                extra virgin olive oil","Preheat the oven to 190°C/375°F/gas 5., In a small bowl, just cover the porcini with boiling water and leave to rehydrate., Bash the fennel and coriander seeds, paprika and 1 teaspoon each of sea salt and black pepper in a pestle and mortar., Carefully cut the squash in half lengthways, deseed, then chop into 4cm chunks. Toss with half the spice mixture and a drizzle of olive oil on a baking tray., Roast for 50 minutes, or until golden, then remove from the oven and reduce the temperature to 150°C/300°F/gas 2., Meanwhile, drizzle both cuts of meat with olive oil and rub with the remaining spice mixture, then place a large casserole pan (at least 30cm wide, 8cm deep) on a medium-high heat., Put the pork and brisket into the pan fat side down and brown on all sides for around 15 minutes in total. Remove both meats to a plate and reduce the heat under the pan to medium., Peel and roughly chop the onions and add to the fat in the pan. Fry for 10 minutes, or until lightly caramelized, stirring regularly., Add the balsamic and the porcini liquor (discarding just the last gritty bit). Roughly chop and add the porcini, followed by the beans (juice and all), then scrunch in the tomatoes through your clean hands., Return both meats to the pan, loosen with a splash of water if needed, then bring to the boil. Season, and sit a layer of wet greaseproof paper directly on the surface. Cover with tin foil and cook in the oven for 5 hours, or until the meat is tender., Prick the peppers and chillies, then blacken all over in a griddle pan or directly over the flame of a gas hob. Place in a bowl, cover and leave to cool, then peel and deseed them, keeping as much juice as you can for extra flavour. Roughly chop with half the coriander, and toss with a little salt and pepper., When the meat is tender, remove from the oven, break up the meat, then stir in the squash, peppers and chillies. Adjust the consistency with water, if needed, taste and season to perfection, and keep warm., To finish, make the salsa. Peel the onion, then finely chop with the apples and the remaining coriander. Dress with the cider vinegar and extra virgin olive oil and season to perfection., Serve the chilli with the salsa. Also good with bread or rice, and yoghurt."
Next-level steak sandwich recipe | Jamie Oliver recipes,A guilty pleasure,"https://img.jamieoliver.com/jamieoliver/recipe-database/oldImages/large/1304_1_1436868285.jpg?tr=w-800,h-1066","['Serves', '4']",In50 minutes,"“Focusing on awesome, sweet onions seriously takes the joy of a steak sandwich up a notch.  ”",553,22.3g,7.5g,24.9g,1.6g,31g,60g,3.6g,"400                                                                                                                                                                g                                                                                                                                                                flank skirt steak or bavette, 2                                                                                                                                                                large                                                                                                                                                                onions, 20                                                                                                                                                                g                                                                                                                                                                unsalted butter, olive oil, 70                                                                                                                                                                g                                                                                                                                                                dark brown sugar, 125                                                                                                                                                                ml                                                                                                                                                                red wine vinegar, 1                                                                                                                                                                                                                    ciabatta loaf, extra virgin olive oil, English mustard                                                                                                                                                                , optional, 1                                                                                                                                                                handful of                                                                                                                                                                watercress","Remove the steak from the fridge and let it come to room temperature, then cover it with greaseproof paper and bash it with the base of a pan to tenderise and make it all roughly the same thickness., Meanwhile, peel the onions, also removing the first layer of flesh (reserve this for a soup or stew), then slice into 2cm-thick rounds., Put the butter, a lug of oil and the sugar into a large non-stick frying pan on a medium heat. Once the butter has melted, place the onions into the pan in a single layer and cook for 5 minutes., Pour in the vinegar, pop the lid on, reduce the heat to low and cook for around 35 minutes, or until beautifully golden and caramelised on the bottom only, adding splashes of water to loosen, if needed., Meanwhile, pop the ciabatta into the oven, turn onto 110°C/225°F/gas ¼ and leave to warm through., Season the steak all over with sea salt and black pepper. Place a large non-stick heavy-bottomed pan on a high heat. Once screaming hot, drizzle the steak with olive oil, then put it into the pan and cook for 3 minutes on each side for medium, or to your liking., Remove to a plate, rest for 1 minute, then slice 1cm thick and toss through its own resting juices with a drizzle of extra virgin olive oil., Cut the warm ciabatta in half and rub the inside of each piece in the steak resting juices. Spread on some mustard, if you like, then layer over the caramelised onions, the steak and pinches of watercress., Pop the other piece of bread on top, press down lightly, carve up into decent chunks and get involved.￼￼￼"
