Recipe title,Subheading,Image (link),Recipe-detail serves,Recipe-detail time,Recipe-detail,Calories,Fat,Saturates,Sugars,Salt,Protein,Carbs,Fibre,Ingred-list,RecipeSteps
Billy's Bolognese | Jamie Oliver recipes,topped with grated cheese,"https://img.jamieoliver.com/jamieoliver/recipe-database/143846725.jpg?tr=w-800,h-1066","['6', 'adults']",30 minutes,,497,11.4g,3.6g,14.6g,0.8g,32.3g,70.6g,5.3g,"2                                                                                                                                                                                                                    onions, 2                                                                                                                                                                cloves of                                                                                                                                                                garlic, 1                                                                                                                                                                                                                    large carrot, 1                                                                                                                                                                stick of                                                                                                                                                                celery, 1                                                                                                                                                                                                                    courgette, olive oil, 500                                                                                                                                                                g                                                                                                                                                                lean beef mince, 2                                                                                                                                                                x 400g tins of                                                                                                                                                                plum tomatoes, 450                                                                                                                                                                g                                                                                                                                                                dried spaghetti, Cheddar or Parmesan                                                                                                                                                                , to serve","Place a large casserole pan on a medium-low heat., Peel the onions and garlic, trim the carrot, celery and courgette. Finely chop or coarsely grate all the veg, then stir it into the pan with 1 tablespoon of olive oil., Cook for 10 to 15 minutes, or until the vegetables are soft and sweet, stirring occasionally., Add the mince, breaking it up with a wooden spoon, then turn the heat up a little and cook for 5 minutes, stirring regularly until the meat is browned and the veg is nicely golden., Scrunch in the tomatoes through clean hands, then half-fill each tin with water, swirl it around to pick up all the last bits of tomato and pour into the pan., Mash everything up with your spoon, add a  pinch of black pepper, reduce the heat to low and leave to cook for 2 to 3 hours, or until thickened and reduced., About 15 minutes before you’re ready to serve, cook the spaghetti in a large pan of boiling salted water according to the packet instructions, then drain. Use tongs to divide between bowls, then spoon over the Bolognese and serve with a good grating of cheese."
Beef short ribs | Jamie Oliver recipes,"Fragrant veg, walnuts, smooth ale, jacket potatoes & horseradish","https://img.jamieoliver.com/jamieoliver/recipe-database/139729014.jpg?tr=w-800,h-1066","['Serves', '6']",4 hours),,726,32.2g,12.2g,28.6g,0.9g,32.2g,76.4g,7.6g,"6                                                                                                                                                                                                                    beef short ribs, bone in (approx 1.6kg), 2                                                                                                                                                                heads of                                                                                                                                                                celery, 6                                                                                                                                                                                                                    carrots (600g total), 50                                                                                                                                                                g                                                                                                                                                                shelled unsalted walnut halves, ½ x 345                                                                                                                                                                g                                                                                                                                                                jar of onion marmalade, 500                                                                                                                                                                ml                                                                                                                                                                smooth ale, 6                                                                                                                                                                                                                    baking potatoes (1.5kg total), creamed horseradish                                                                                                                                                                , to serve",
Somali Beef Stew | Jamie Oliver recipes,,"https://img.jamieoliver.com/jamieoliver/recipe-database/137896834.jpg?tr=w-800,h-1066","['to', '8']",,"“This stew is a wonderful way to stretch a little meat into a large, satisfying pot of food. The combination of Xawaash Spice Mix and tomato paste is particularly great, a match made in flavor heaven. Serve over plain rice with hot sauce and cilantro for topping, lime wedges for squeezing over, and bananas for eating alongside (this is very typical in Somalia—a bite of stew and rice followed by a bite of banana and so on). You can make the stew up to a week in
advance and refrigerate it in an airtight container (it gets even better the longer it sits) or freeze it in an airtight container for up to 2 months (defrost in the refrigerator for up to a day before serving). Gently rewarm the stew in a heavy pot set over low heat before serving. ”",,,,,,,,,"2                                                                                                                                                                tablespoons                                                                                                                                                                canola oil, 1                                                                                                                                                                                                                    red onion                                                                                                                                                                , thinly sliced, 3                                                                                                                                                                                                                    garlic cloves                                                                                                                                                                , minced, 2                                                                                                                                                                tablespoons                                                                                                                                                                Xawaash Spice Mix                                                                                                                                                                , (page 74 of In Bibi's Kitchen), 2                                                                                                                                                                tablespoons                                                                                                                                                                tomato paste, 2                                                                                                                                                                teaspoons                                                                                                                                                                kosher salt                                                                                                                                                                , plus more as needed, 2                                                                                                                                                                cups                                                                                                                                                                water, 2                                                                                                                                                                pounds                                                                                                                                                                boneless beef chuck or other stew meat                                                                                                                                                                , cut into bite-sized pieces, 2                                                                                                                                                                                                                    baking potatoes                                                                                                                                                                , cut into bite-sized pieces, 2                                                                                                                                                                                                                     large carrots                                                                                                                                                                , cut into thin coins, 1                                                                                                                                                                                                                    red bell pepper                                                                                                                                                                , stemmed, seeded, and cut into thin strips, Cooked rice, hot sauce (such as Somali Cilantro and Green Chile Pepper Sauce, page 80 of In Bibi's Kitchen), cilantro leaves, lime wedges, and fresh bananas",
Loaded beefburger,"Oozy cheese, sweet red peppers, mustard & pickles","https://img.jamieoliver.com/jamieoliver/recipe-database/138452754.jpg?tr=w-800,h-1066","['Serves', '4']",In28 minutes,,717,33.2g,13.5g,9.2g,2.3g,42.3g,61.1g,2.7g,"400                                                                                                                                                                g                                                                                                                                                                beef mince, 1 x 250                                                                                                                                                                g                                                                                                                                                                packet of cooked lentils, 50                                                                                                                                                                g                                                                                                                                                                mixed baby cornichons & pickled onions, 100                                                                                                                                                                g                                                                                                                                                                Cheddar cheese, 1                                                                                                                                                                                                                    large jarred roasted red pepper, olive oil, 2                                                                                                                                                                tablespoons                                                                                                                                                                Dijon mustard, 4                                                                                                                                                                                                                    burger buns",
Harissa meatball wraps | Jamie Oliver recipes,Cabbage & apple slaw,"https://img.jamieoliver.com/jamieoliver/recipe-database/134622444.jpg?tr=w-800,h-1066","['meatball', 'portions']",In30 minutes,"“It's always handy to have a stash of tasty meal elements ready and waiting in the freezer for those extra-busy days. This recipe will give you two leftover meatball portions, but I often make a double batch so that with just a little extra investment upfront I can get a whole meal or two on the table in minutes another day. Winning! ”",434,12.1g,4.3g,12g,1.8g,28.3g,50.3g,9.4g,"500                                                                                                                                                                g                                                                                                                                                                minced beef, 1 x 250                                                                                                                                                                g sachet of                                                                                                                                                                cooked grains or lentils, 1                                                                                                                                                                                                                    lemon, 1                                                                                                                                                                bunch of                                                                                                                                                                fresh flat-leaf parsley                                                                                                                                                                , (30g), 3                                                                                                                                                                teaspoons                                                                                                                                                                harissa, 350                                                                                                                                                                g                                                                                                                                                                red cabbage, 1                                                                                                                                                                small                                                                                                                                                                red onion, 1                                                                                                                                                                                                                    red apple, 4                                                                                                                                                                tablespoons                                                                                                                                                                natural yoghurt, olive oil, 4                                                                                                                                                                                                                    wholemeal tortilla, pickled chillies                                                                                                                                                                , optional","Place 500g minced beef and 1 x 250g sachet of cooked grains or lentils into a food processor, finely grate in the zest of 1 lemon, and tear in ½ a bunch of fresh flat-leaf parsley (15g)., Add 2 teaspoons of harissa and a good pinch of sea salt and black pepper, then blitz to combine., On a large sheet of greaseproof paper, split the mixture into 24 pieces and, with wet hands, roll into balls., Trim and finely slice 350g of red cabbage and peel and finely slice 1 small red onion, then place in a bowl with the juice of ½ a lemon and a pinch of salt and pepper. Scrunch together well., Slice the apple into matchsticks and pick the leaves from ½ a bunch of fresh flat-leaf parsley (15g), then add to the bowl and toss together., Place 16 meatballs (freeze the rest for another day) into a large non-stick frying pan on a medium heat with 1 tablespoon of olive oil and fry for 7 minutes, or until golden and cooked through, turning occasionally., Meanwhile, ripple 1 teaspoon of harissa through 4 tablespoons of natural yoghurt., Warm 4 tortilla through, then serve alongside the pan of meatballs (4 per per portion), slaw, harissa yoghurt and pickled chillies (if using), then let everyone build and roll up their own."
