Recipe title,Subheading,Image (link),Recipe-detail serves,Recipe-detail time,Recipe-detail,Calories,Fat,Saturates,Sugars,Salt,Protein,Carbs,Fibre,Ingred-list,RecipeSteps
"Steak, Guinness & cheese pie | Jamie Oliver recipes","A hearty, boozy pie","https://img.jamieoliver.com/jamieoliver/recipe-database/oldImages/large/543_1_1436890062.jpg?tr=w-800,h-1066","['Serves', '6']",50 minutes,“There's nothing like a comforting steak and Guinness pie to warm your cockles when it's cold outside. ”,715,45.8g,20g,8.6g,1.3g,43.3g,28.8g,4.4g,"3                                                                                                                                                                                                                    red onions, 3                                                                                                                                                                cloves of                                                                                                                                                                garlic, 2                                                                                                                                                                                                                    carrots, 2                                                                                                                                                                sticks of                                                                                                                                                                celery, 4                                                                                                                                                                                                                    field mushrooms, a few                                                                                                                                                                sprigs of                                                                                                                                                                rosemary, olive oil, 1                                                                                                                                                                kg                                                                                                                                                                quality brisket or stewing beef                                                                                                                                                                , cut into 2cm cubes, 440                                                                                                                                                                ml                                                                                                                                                                Guinness (no lager, please!), 2                                                                                                                                                                heaped tablespoons                                                                                                                                                                plain flour                                                                                                                                                                , plus extra for dusting, 140                                                                                                                                                                g                                                                                                                                                                Cheddar cheese, 170                                                                                                                                                                g                                                                                                                                                                puff pastry, 1                                                                                                                                                                large                                                                                                                                                                egg","Preheat the oven to 190ºC/375ºF/gas 5., Peel and chop the onions, garlic, carrots and celery, slice the mushrooms, and pick and finely chop the rosemary., Heat 1 tablespoon of olive oil in a large ovenproof pan over a low heat, add the onions and fry gently for about 10 minutes, or until softened, stirring occasionally., Turn the heat up, add the garlic, carrots, celery and mushrooms, then mix everything together before stirring in the beef, rosemary, and a pinch of sea salt and 1 level teaspoon of black pepper., Fry fast for 3 or 4 minutes, then pour in the Guinness, stir in the flour and add just enough water to cover., Bring to a simmer, cover the pan with a lid and place in the oven for 2½ hours, or until the meat is very tender and the stew is rich, dark and thick, stirring halfway. A perfect pie filling needs to be robust, so if it’s still quite liquidy, place the pan on the hob and reduce until the sauce thickens., Coarsely grate the cheese, stir half through the pie filling, then transfer to a pie dish and leave to cool slightly., Meanwhile, dust a clean work surface with flour and roll the pastry out to the thickness of a pound coin., Sprinkle the remaining cheese over the pie filling. Place the pastry over the top of the pie dish pinching or folding and tucking in the edges to seal, then lightly score the surface with a criss-cross pattern., Beat the egg, then brush over the top of the pie and bake directly on the bottom of the oven for 45 minutes, or until the pastry is cooked, puffed and beautifully golden. Delicious served simply with peas."
Steak & salsa verde | Beef recipes | Jamie Oliver recipes,"Coriander, mint, chilli, lime","https://img.jamieoliver.com/jamieoliver/recipe-database/oldImages/large/541_6_1350393300.jpg?tr=w-800,h-1066","['Serves', '4']",In25 minutes,"“To make a really authentic, full-of-flavour salsa verde, chop up all those lovely herbs by hand. ”",376,30.4g,10.9g,2g,2.18g,23.4g,2.5g,0.8g,"450                                                                                                                                                                g                                                                                                                                                                flank steak, 1                                                                                                                                                                clove of                                                                                                                                                                garlic, MEXICAN SALSA VERDE, 1                                                                                                                                                                clove                                                                                                                                                                garlic, 1-2                                                                                                                                                                                                                    fresh green chillies, 4                                                                                                                                                                                                                    spring onions, 2                                                                                                                                                                                                                    ripe tomatoes, ½ a                                                                                                                                                                bunch of                                                                                                                                                                fresh coriander, ½ a                                                                                                                                                                bunch of                                                                                                                                                                fresh mint, 1-2                                                                                                                                                                                                                    limes, 1lb flank steak, 1 clove garlic, MEXICAN SALSA VERDE, 1 clove garlic, 1-2 fresh jalapeno or serrano chiles, 4 spring scallions, 2 ripe tomatoes, ½ a bunch of fresh cilantro, ½ a bunch of fresh mint, 1-2 limes","Remove the steak from the fridge and leave to come up to room temperature., To make the salsa, peel the garlic, deseed the chillies, trim the spring onions and roughly chop the tomatoes. Reserve a few coriander sprigs, then chop the rest (stalks and all), with the mint leaves, garlic, chillies, spring onions and tomatoes on a large board – keep chopping and mixing until super-fine., Season with sea salt and black pepper, then squeeze over most of the lime juice, and drizzle lightly with extra virgin olive oil. Mix together well, taste and tweak with a little more salt, pepper or lime juice, then scrape into a bowl., Heat a frying pan or griddle pan over a high heat. Season the steak with the salt, pepper, and drizzle with olive oil., Cook the steak in the hot pan for 6 to 7 minutes on each side, or until cooked to your liking. Halve the garlic clove, and rub the steak with the cut side during cooking for bonus flavour. Remove to a plate to rest., Cut the steak against the grain and with the knife at an angle into ½cm slices, then arrange on a serving platter or divide between plates., Finish with a few dollops of salsa, and scatter over the reserved coriander leaves. Drizzle over any resting juices, then tuck in., Remove the steak from the refrigerator and leave to come up to room temperature., To make the salsa, peel the garlic, seed the chilies, trim the scallions and roughly chop the tomatoes. Reserve a few cilantro sprigs, then chop the rest (stalks and all), with the mint leaves, garlic, chilies, scallions and tomatoes on a large board – keep chopping and mixing until super-fine., Season with sea salt and black pepper, then squeeze over most of the lime juice, and drizzle lightly with extra virgin olive oil. Mix together well, taste and tweak with a little more salt, pepper or lime juice, then scrape into a bowl., Heat a frying pan or grill pan over a high heat. Season the steak with the salt, pepper, and drizzle with olive oil., Cook the steak in the hot pan for 6 to 7 minutes on each side, or until cooked to your liking. Halve the garlic clove, and rub the steak with the cut side during cooking for bonus flavour. Remove to a plate to rest., Cut the steak against the grain and with the knife at an angle into ½cm slices, then arrange on a serving platter or divide between plates., Finish with a few dollops of salsa, and scatter over the reserved cilantro leaves. Drizzle over any resting juices, then tuck in."
Sloppy Joes | Beef Recipes | Jamie Oliver Recipes,Roll up for an all-American meaty wrap,"https://img.jamieoliver.com/jamieoliver/recipe-database/oldImages/large/500_6_1350907298.jpg?tr=w-800,h-1066","['Serves', '4']",In35 minutes,"“I like my sloppy Joe recipe in easy-to-eat wraps, but the turkey and beef work in burger buns too ”",418,6.8g,2.5g,20.3g,1.31g,38.9g,53.8g,8.3g,"¾                                                                                                                                                                pound                                                                                                                                                                quality lean ground beef (10% fat) or turkey, 1                                                                                                                                                                                                                    yellow onion                                                                                                                                                                , peeled and diced, 1                                                                                                                                                                                                                    green bell pepper                                                                                                                                                                , cored, seeded and diced, ¾                                                                                                                                                                cup                                                                                                                                                                tomato puree, 2                                                                                                                                                                tablespoons                                                                                                                                                                cider vinegar, 1½                                                                                                                                                                tablespoons                                                                                                                                                                light brown sugar, 1                                                                                                                                                                tablespoon                                                                                                                                                                honey, 2                                                                                                                                                                teaspoons                                                                                                                                                                Dijon mustard, ½                                                                                                                                                                teaspoon                                                                                                                                                                chilli powder, ½                                                                                                                                                                can                                                                                                                                                                kidney beans                                                                                                                                                                , drained and rinsed, freshly ground pepper                                                                                                                                                                , to taste, 4                                                                                                                                                                                                                    whole wheat hamburger buns or whole wheat wraps, 1                                                                                                                                                                cup                                                                                                                                                                shredded lettuce","Put a large sauté pan over a medium heat and crumble in the beef or turkey. Fry until the meat starts to brown then add the bell pepper and onion. Continue cooking, stirring occasionally, until the veggies start to soften – this should take around 5 to 10 minutes., When the veggies are tender, add the tomato purée and stir into the meat, then add the vinegar, brown sugar, honey, mustard and chile powder to the pan and give everything a really good stir. Add the beans, season with salt and pepper, then bring to a boil and cook until the sauce is nice and thick., To serve: pile the Sloppy Joe mix onto the bottom of a bun or middle of a wrap, top it with lettuce and close up the sandwich or roll up the wrap., Serving suggestions:
Delicious served with an Everyday chopped green salad or some Brilliant broccoli., Jamie’s top tips
• Look out for ground beef with around 10% fat – if buying turkey, try to buy the best quality you can afford. Don’t buy poor-quality turkey mince. If your grocery store has a meat counter you can ask them to grind the meat for you.
• This can be made completely ahead of time and reheated just before serving. If you’re reheating Sloppy Joes, add water a little bit at a time to loosen.
• If you want to give it a bit of a kick add some more chile powder or even a chopped fresh chile., Tips from the dietitian:
• Sloppy Joe is a real favorite, but for a healthier version, use lean ground turkey instead of beef – the leaner meat is better for the heart.
• Rinsing beans removes some of the salt but you can also look for low-sodium or no-salt-added beans."
