Recipe title,Subheading,Image (link),Recipe-detail serves,Recipe-detail time,Recipe-detail,Calories,Fat,Saturates,Sugars,Salt,Protein,Carbs,Fibre,Ingred-list,RecipeSteps
Smoky mussel laksa | Jamie Oliver recipes,"Blackened aubergine, juicy noodles, coconut, coriander & lime","https://img.jamieoliver.com/jamieoliver/recipe-database/136440331.jpg?tr=w-800,h-1066","['Serves', '2']",In16 minutes,,486,15.9g,11g,12.8g,1.4g,21.1g,64.3g,8.7g,"2                                                                                                                                                                x 50g                                                                                                                                                                nests of folded rice noodles, 600g                                                                                                                                                                                                                    mussels, scrubbed, debearded, from sustainable sources, 1                                                                                                                                                                                                                    large aubergine (400g), 1                                                                                                                                                                bunch of                                                                                                                                                                spring onions, ½                                                                                                                                                                a bunch of                                                                                                                                                                coriander (15g), 2                                                                                                                                                                                                                    limes, 2                                                                                                                                                                tablespoons                                                                                                                                                                laksa paste, 1                                                                                                                                                                x 400ml                                                                                                                                                                tin of light coconut milk",
Creamy Cornish mussels | Jamie Oliver seafood recipes,"Sweet cider, chives & clotted cream","https://img.jamieoliver.com/jamieoliver/recipe-database/89080979.jpg?tr=w-800,h-1066","['Serves', '2']",In12 minutes,,347,24.6g,11.2g,4.2g,0.8g,15.2g,8.4g,0.7g,"600                                                                                                                                                                g                                                                                                                                                                mussels                                                                                                                                                                , scrubbed, debearded, from sustainable sources, 4                                                                                                                                                                cloves of                                                                                                                                                                garlic, 1                                                                                                                                                                bunch of                                                                                                                                                                fresh chives                                                                                                                                                                , (30g), 250                                                                                                                                                                ml                                                                                                                                                                Cornish cider, 50                                                                                                                                                                g                                                                                                                                                                clotted cream","Check the mussels – if any are open, give them a tap and they should close; if they don’t, discard them., Peel and finely slice the garlic. Finely chop the chives., Put a large deep pan on a high heat. Pour in 1 tablespoon of olive oil, then add the garlic and most of the chives, followed 1 minute later by the cider., Bring to a fast boil, then add the mussels and clotted cream, cover and leave for 3 to 4 minutes, shaking the pan occasionally., When all the mussels have opened and are soft and juicy, they’re ready. If any remain closed, discard them., Taste the sauce, season to perfection with sea salt and black pepper, then dish up and sprinkle over the remaining chives before tucking in."
Martin Clunes' Mallorcan paella | Rice recipes | Jamie Oliver recipes,"Chicken, pork, crayfish, tiger prawns, mussels & squid","https://img.jamieoliver.com/jamieoliver/recipe-database/83619422.jpg?tr=w-800,h-1066","['Serves', '6']",15 minutes,"“Igniting fond memories of happy childhood holidays for Martin, my take on a Mallorcan paella brimming with beautiful seafood is a real flavour extravaganza. Use a mixture of whatever lovely seasonal shellfish you can get your hands on. ”",642,19.8g,3.9g,6.6g,3.1g,58.3g,66.3g,3.4g,"6                                                                                                                                                                large                                                                                                                                                                raw shell-on tiger prawns                                                                                                                                                                , from sustainable sources, 1                                                                                                                                                                pinch of                                                                                                                                                                saffron, 1.2                                                                                                                                                                litres                                                                                                                                                                quality organic chicken stock, 3                                                                                                                                                                                                                    free-range chicken thighs                                                                                                                                                                , skin off, bone out, 300                                                                                                                                                                g                                                                                                                                                                higher-welfare pork neck fillet, 1                                                                                                                                                                heaped teaspoon                                                                                                                                                                smoked paprika, olive oil, 1                                                                                                                                                                                                                    red onion, 5                                                                                                                                                                cloves of                                                                                                                                                                garlic, 2                                                                                                                                                                sticks of                                                                                                                                                                celery, 6                                                                                                                                                                                                                    crayfish                                                                                                                                                                , from sustainable sources, 6                                                                                                                                                                                                                    ripe tomatoes, 400                                                                                                                                                                g                                                                                                                                                                paella rice, 1                                                                                                                                                                bunch of                                                                                                                                                                fresh flat-leaf parsley                                                                                                                                                                , (30g), 200                                                                                                                                                                g                                                                                                                                                                squid                                                                                                                                                                , gutted, cleaned, from sustainable sources, 200                                                                                                                                                                g                                                                                                                                                                mussels                                                                                                                                                                , scrubbed, debearded, from sustainable sources, 200                                                                                                                                                                g                                                                                                                                                                jarred artichokes, 150                                                                                                                                                                g                                                                                                                                                                mangetout, extra virgin olive oil, 2-3                                                                                                                                                                                                                    lemons","Preheat the oven to 190ºC/375ºF/gas 5., Peel the prawns, leaving the tails on, then put in the fridge. Place the heads and shells in a pan with the saffron, pour over the stock, then simmer over a low heat to infuse., Dice the chicken and pork into 3cm chunks, then toss with the paprika and a pinch of sea salt and black pepper., Place a large ovenproof frying or paella pan on a medium heat with 1 tablespoon of olive oil. Add the meat and cook for 10 to 15 minutes, or until golden, stirring occasionally, while you peel and finely chop the onion, garlic and celery., Remove the meat to a plate and stir the chopped veg into the fat in the pan. Cook for 10 minutes, or until softened, then return the meat to the mix., At the same time, quickly drop the crayfish into the stock to cook for 4 minutes, remove with a slotted spoon, halve lengthways and place in a large bowl., Cut a cross into the bottom of each tomato, plunge them into the stock for 40 seconds, then carefully peel, deseed and roughly chop., Stir the paella rice into the meat pan to toast for a few minutes, then ladle in 1 litre of stock through a sieve. Add the tomatoes and simmer for 10 minutes, or until the liquid has reduced and the rice is nearly cooked, stirring occasionally., Meanwhile, pick and finely chop the parsley. Run the tip of a knife down the back of each prawn and pull out the vein, meaning they’ll butterfly as they cook., Slice the tentacles from the squid, keeping them whole, then open out the tubes and lightly score in a criss-cross fashion with a regular eating knife., Place the prawns, squid and mussels in the crayfish bowl with the drained artichokes, most of the parsley and the mangetout (roughly slice, if you like), then dress with a drizzle of extra virgin olive oil, the juice of 1 lemon and a good pinch of sea salt and black pepper., Poke and scatter the contents of the bowl into the rice, then place uncovered in the oven for 10 minutes, or until beautifully cooked. Scatter over the remaining parsley leaves and serve with lots of lemon wedges for squeezing over."
Pesto mussels & toast | Seafood recipe | Jamie Oliver recipes,"Baby courgettes, sweet tomatoes & peas","https://img.jamieoliver.com/jamieoliver/recipe-database/51035095.jpg?tr=w-800,h-1066","['Serves', '2']",In14 minutes,"“Mussels are a super-nutritious member of the shellfish family, packed with micronutrients including iodine and selenium, two important minerals for healthy metabolic function. ”",471,22.1g,4.6g,11.7g,1.3g,30.8g,36.5g,8.7g,"70                                                                                                                                                                g                                                                                                                                                                pesto, 2                                                                                                                                                                thick slices of                                                                                                                                                                wholemeal bread                                                                                                                                                                 , (50g each), 200g                                                                                                                                                                baby courgettes, 200g                                                                                                                                                                ripe mixed-colour cherry tomatoes                                                                                                                                                                , on the vine, 500g                                                                                                                                                                mussels                                                                                                                                                                , scrubbed, debearded, from sustainable sources, 160g                                                                                                                                                                fresh or frozen peas, 50ml                                                                                                                                                                white wine                                                                                                                                                                , optional, 2                                                                                                                                                                sprigs of                                                                                                                                                                fresh basil, 2½ oz pesto, 2 thick slices of whole-grain bread (1¾ oz each), 7 oz baby zucchini, 7 oz ripe mixed-color cherry tomatoes, on the vine, 1 lb mussels, scrubbed, debearded, from sustainable sources, 1¼ cups fresh or frozen peas, optional: ¼ cup white wine, 2 sprigs of fresh basil","Put a large pan on a medium-high heat, and toast the bread as the pan heats up, turning when golden., Trim and finely slice the courgettes, and halve the cherry tomatoes., Check the mussels – if any are open, just give them a little tap and they should close; if they don’t they’re no good, so chuck those ones away., Remove the toast and spread one quarter of the pesto on each slice. You can find a recipe for my Super-quick batch pesto, if you'd like to have a go at making your own., Turn the heat under the pan up to full whack and tip in the mussels. Stir in the remaining pesto, the courgettes, tomatoes and peas., Add the wine (if using), or a good splash of water. Cover with a lid and leave to steam for 3 to 4 minutes, shaking the pan occasionally., When all the mussels have opened and are soft and juicy, they’re ready. If any remain closed, simply throw those away. Divide the mussels, veg and all those gorgeous juices between two large bowls, pick over the basil leaves and serve with the pesto toasts on the side for some epic dunking., Put a large pan on a medium-high heat, and toast the bread as the pan heats up, turning when golden., Trim and finely slice the zucchini, and halve the cherry tomatoes., Check the mussels—if any are open, just give them a little tap and they should close; if they don’t they’re no good, so chuck those ones away., Remove the toast and spread half of the pesto on each slice., Turn the heat under the pan up to full whack and tip in the mussels. Stir in the remaining pesto, the zucchini, tomatoes, and peas., Add the wine (if using), or a good splash of water. Cover with a lid and leave to steam for 3 to 4 minutes, shaking the pan occasionally., When all the mussels have opened and are soft and juicy, they’re ready. If any remain closed, simply throw those away. Divide the mussels, veg, and all those gorgeous juices between two large bowls, pick over the basil leaves, and serve with the pesto toasts on the side for some epic dunking."
Thai-style mussels | Seafood recipes | Jamie magazine,"Lemongrass, red chilli & coconut milk","https://img.jamieoliver.com/jamieoliver/recipe-database/FWV-AstiKPY8VrKpVynL6_.jpg?tr=w-800,h-1066","['Serves', '2']",In15 minutes,,328,18.8g,11.5g,6.7g,2g,26.2g,13g,1.6g,"1                                                                                                                                                                kg                                                                                                                                                                mussels                                                                                                                                                                , debearded, from sustainable sources, 4                                                                                                                                                                                                                    spring onions, 2                                                                                                                                                                cloves of                                                                                                                                                                garlic, ½                                                                                                                                                                a bunch of                                                                                                                                                                fresh coriander, 1                                                                                                                                                                stick of                                                                                                                                                                lemongrass, 1                                                                                                                                                                                                                    fresh red chilli, groundnut oil, 1 x 400                                                                                                                                                                ml tin of                                                                                                                                                                reduced fat coconut milk, 1                                                                                                                                                                tablespoon                                                                                                                                                                fish sauce, 1                                                                                                                                                                                                                    lime","Wash the mussels thoroughly, discarding any that aren’t tightly closed., Trim and finely slice the spring onions, peel and finely slice the garlic. Pick and set aside the coriander leaves, then finely chop the stalks. Cut the lemongrass into 4 pieces, then finely slice the chilli., In a wide saucepan, heat a little groundnut oil and soften the spring onion, garlic, coriander stalks, lemongrass and most of the red chilli for around 5 minutes., Add the coconut milk and fish sauce and bring to the boil, then add the mussels and cover the pan., Steam the mussels for 5 minutes, or until they've all opened and are cooked. Discard any unopened mussels., Finish with a squeeze of lime juice, then sprinkle with coriander leaves and the remaining chilli to serve."
