Recipe title,Subheading,Image (link),Recipe-detail serves,Recipe-detail time,Recipe-detail,Calories,Fat,Saturates,Sugars,Salt,Protein,Carbs,Fibre,Ingred-list,RecipeSteps
Shellfish & Cider Stew | Seafood recipes | Jamie magazine recipes,"With leeks, shallots & tomatoes","https://img.jamieoliver.com/jamieoliver/recipe-database/7AgL0WAFaQl8pyLyPeLkBs.jpg?tr=w-800,h-1066","['Serves', '6']",,“This impressive seafood stew is reminiscent of moules marinières but is extra luxurious thanks to the addition of langoustines. ”,273,7.8g,3.5g,7.2g,1.5g,30.6g,11g,2.7g,"3                                                                                                                                                                                                                    leeks, 3                                                                                                                                                                                                                    shallots, 4                                                                                                                                                                                                                    ripe plum tomatoes, ½                                                                                                                                                                a bunch of                                                                                                                                                                fresh flat-leaf parsley, 1                                                                                                                                                                tablespoon                                                                                                                                                                unsalted butter, 500                                                                                                                                                                ml                                                                                                                                                                organic fish stock, 750                                                                                                                                                                ml                                                                                                                                                                quality cider, 6                                                                                                                                                                                                                    langoustines                                                                                                                                                                , from sustainable sources, 6                                                                                                                                                                                                                    razor clams                                                                                                                                                                , scrubbed, from sustainable sources, 600                                                                                                                                                                g                                                                                                                                                                mussels                                                                                                                                                                , scrubbed, debearded, from sustainable sources, 600                                                                                                                                                                g                                                                                                                                                                clams                                                                                                                                                                , scrubbed, from sustainable sources, 3                                                                                                                                                                tablespoons                                                                                                                                                                double cream, 1                                                                                                                                                                teaspoon                                                                                                                                                                tomato purée","Trim the leeks, cut off the green part and save it for another day. Halve the white part lengthways, then finely slice., Finely slice the shallots, then peel, deseed and cut the tomatoes into cubes. Roughly chop the parsley, including the stalks., Melt the butter in a large pan over a low heat and gently fry the leeks, shallots, tomatoes and parsley until soft., Season, then add the stock and 500ml of cider. Turn up the heat and allow the liquid to boil for 10 minutes, until it reduces a little., Warm a large serving bowl or tureen., Add the langoustines and cover with a lid for 3 minutes, then add the razor clams. Replace the lid and cook for a further 2 minutes., Add the mussels and clams. Give it all a gentle stir, add another good splash of cider and replace the lid. Cook for a further 5 minutes, or until the mussels and clams have opened and the rest of the shellfish is cooked., Using tongs and a slotted spoon, transfer the shellfish to the warmed serving bowl and put the sauce back on the heat., Add the cream and tomato purée and a little more cider if you want more sauce. Stir well to combine, and pour the sauce over the shellfish in the bowl. Serve immediately – delicious with crusty bread."
Mussel Linguine | Pasta Recipes | Jamie Oliver Recipes,,"https://img.jamieoliver.com/jamieoliver/recipe-database/oldImages/large/951_1_1439213778.jpg?tr=w-800,h-1066","['Serves', '2']",In10 minutes,,677,20.1g,1.4g,5.6g,1.54g,49.1g,72.8g,0g,"extra virgin olive oil, 2                                                                                                                                                                cloves of                                                                                                                                                                garlic                                                                                                                                                                , sliced, 1-2                                                                                                                                                                pinches of                                                                                                                                                                crumbled dried chilli, 1                                                                                                                                                                                                                    anchovy fillet, 12                                                                                                                                                                                                                    ripe cherry tomatoes                                                                                                                                                                , halved, 250                                                                                                                                                                g                                                                                                                                                                fresh linguine, 1                                                                                                                                                                kg                                                                                                                                                                mussels                                                                                                                                                                , washed and debearded, a                                                                                                                                                                small bunch of                                                                                                                                                                fresh parsley                                                                                                                                                                , chopped, sea salt, freshly ground black pepper","Nonno Contaldo is my mentor Gennaro’s dad, but as far as Nonno is concerned, he thinks I’m his grandson! (You can make of that what you will!). I was really surprised to find out that Nonno lives by himself, and I was very impressed to hear that he still cooks for himself every day; although there are always friends and family nearby to help him if he needs it. His favourite thing to cook for himself is mussels with pasta, so I’m going to talk you through the recipe as he explained it to me., Get a pan of salted water on to boil. Pour a few drizzles of extra virgin olive oil into a separate little pan and put it on a medium heat. Add the garlic, dried chilli and anchovy, then squeeze in and add the cherry tomatoes as the garlic begins to fry – at no point should the garlic take on any colour, but you need the heat to be hot enough to melt the anchovies. The juice from the tomatoes and oil will make a light, very delicate and simple sauce., Add the linguine to the pan of boiling water and cook according to packet instructions. Meanwhile, add a good handful of washed and debearded mussels to the tomato sauce. Give the pan a little toss, then place a lid on top and cook until all the mussels are open. As usual with mussels, if any remain closed after cooking, throw them away. Add a handful of chopped parsley to the pan., The pasta will now be a little under al dente and only a minute away from being ready. Nonno likes to drain his pasta, saving a little of the cooking water, then he puts the pasta back into the big pot and pours the mussel sauce over the top, mixing everything together well. Put the pot back on a low heat for an extra minute or two to cook the pasta perfectly – it will suck up all the lovely mussel juice. To finish, drizzle over a good bit of olive oil, season to taste and serve immediately."
Mussel Chowder | Seafood Recipes | Jamie Oliver Recipes,Hearty and full of flavour,"https://img.jamieoliver.com/jamieoliver/recipe-database/oldImages/large/776_1_1438764314.jpg?tr=w-800,h-1066","['Serves', '4']",In35 minutes,“This tasty corn chowder is really comforting and the fresh mussels give a beautiful depth of flavour ”,267,9.9g,3.1g,5.2g,,10.5g,31.4g,,"olive oil, 2                                                                                                                                                                rashers                                                                                                                                                                higher-welfare bacon                                                                                                                                                                , chopped, 1                                                                                                                                                                small                                                                                                                                                                white onion                                                                                                                                                                , finely chopped, 2                                                                                                                                                                sticks                                                                                                                                                                celery                                                                                                                                                                , finely chopped, 1                                                                                                                                                                                                                    fresh red chilli                                                                                                                                                                , deseeded and finely chopped, 4                                                                                                                                                                ears                                                                                                                                                                sweetcorn, 2                                                                                                                                                                medium                                                                                                                                                                potatoes                                                                                                                                                                , peeled and chopped, 900                                                                                                                                                                ml                                                                                                                                                                organic vegetable or fish stock                                                                                                                                                                , hot, 1                                                                                                                                                                handful                                                                                                                                                                fresh, live mussels                                                                                                                                                                , from sustainable sources, ask your fishmonger, cleaned and drained, 4                                                                                                                                                                tablespoons                                                                                                                                                                single cream, 1                                                                                                                                                                small handful                                                                                                                                                                chopped fresh parsley","This tasty corn chowder is really comforting and the fresh mussels give a beautiful depth of flavour., Heat a splash of oil in a large saucepan over a medium-low heat. Add the bacon, onion, celery and chilli and sweat down for 5 minutes, stirring, until soft but not browned., Peel the husk from the corn and slice off the kernels with a sharp knife. Add the sweetcorn and potato to the saucepan, along with the stock. Bring to the boil, then simmer gently for 10 minutes, or until the potato is soft. Blitz very roughly with a hand blender (or cool slightly, then blend in batches in a food processor, returning the chowder to the saucepan)., Add the mussels and cream, bring quickly to the boil and cook for a few minutes until the mussels have opened – discard any that remain closed. You can take the mussels out of their shells, if you like. Remove from the heat and season. Divide the chowder between bowls and serve sprinkled with the chopped parsley."
Wood-fired shellfish | Seafood Recipes | Jamie Oliver Recipes,With gorgeous lemony garlic dressing,"https://img.jamieoliver.com/jamieoliver/recipe-database/oldImages/large/658_1_1438878588.jpg?tr=w-800,h-1066","['Serves', '6']",In30 minutes,“This oven-to-table treat is great for sharing with friends and lovely with fresh bread for dunking ”,314,11g,1.5g,0.5g,2.19g,43.2g,9.7g,1.1g,"2                                                                                                                                                                kg                                                                                                                                                                mixed seafood, such as clams, mussels, prawns and scallops                                                                                                                                                                , from sustainable sources, ask your fishmonger, 2                                                                                                                                                                cloves                                                                                                                                                                garlic                                                                                                                                                                , peeled, sea salt, freshly ground black pepper, 2                                                                                                                                                                                                                    lemons, extra virgin olive oil, a few                                                                                                                                                                sprigs of                                                                                                                                                                soft fresh herbs, such as parsley, mint and tarragon                                                                                                                                                                , leaves picked and chopped, to serve","Fire up the wood-fired oven an hour or two before you're ready to cook. When the temperature has reached 180°C, or slightly lower (check your thermometer), and the smoke and flames have died down, you can start cooking. Always keep an eye on the fire and top up the heat source, if needed., Clean and wash the shellfish, pulling the beards off the mussels and throwing away any open ones., Peel the garlic and bash with a good pinch of sea salt in a pestle and mortar until creamy, then finely grate in the lemon zest. Add a good pinch of black pepper and pour in enough oil to make a dressing., Tip the shellfish into a large roasting tray and drizzle with the dressing. Toss everything together, then spread the shellfish out into an even layer., Halve the lemons, add them to the tray, then slide the tray into the hot oven and roast for 10 minutes or until all the shells have opened and the prawns and scallops are golden and cooked through. Keep an eye on them and rotate the tray for even cooking., Pick and chop the herb leaves and serve the shellfish straight away, scattered with chopped herbs, and with lots of napkins!"
