Recipe title,Subheading,Image (link),Recipe-detail serves,Recipe-detail time,Recipe-detail,Calories,Fat,Saturates,Sugars,Salt,Protein,Carbs,Fibre,Ingred-list,RecipeSteps
5-a-day spiced veg stew | Jamie Oliver recipes,"Fragrant coconut broth, coriander & lime","https://img.jamieoliver.com/jamieoliver/recipe-database/134622143.jpg?tr=w-800,h-1066","['Serves', '2']",In53 minutes,,414,11.2g,6g,39g,1.8g,11.8g,69.4g,15.8g,"1                                                                                                                                                                                                                    sweet potato                                                                                                                                                                , (300g), 1                                                                                                                                                                                                                    aubergine                                                                                                                                                                , (250g), 2                                                                                                                                                                                                                    mixed-colour peppers, 2                                                                                                                                                                                                                    onions, olive oil, ½                                                                                                                                                                a bunch of                                                                                                                                                                fresh coriander                                                                                                                                                                , (15g), 30                                                                                                                                                                g                                                                                                                                                                sun-dried tomatoes, 2                                                                                                                                                                tablespoons                                                                                                                                                                Thai curry paste                                                                                                                                                                , (choose your favourite), ½ x 400                                                                                                                                                                g tin of                                                                                                                                                                light coconut milk, 160                                                                                                                                                                g                                                                                                                                                                mangetout, 2                                                                                                                                                                teaspoons                                                                                                                                                                soy or fish sauce, 1                                                                                                                                                                                                                    lime, 2                                                                                                                                                                                                                    flatbreads                                                                                                                                                                , optional","Scrub 1 sweet potato (300g) and slice into rounds, about ½cm thick. Trim 1 aubergine (250g) and 2 mixed-colour peppers, then chop into 3cm chunks., Char the vegetables in a large dry casserole pan over a high heat for 5 minutes – work in batches, removing to a plate as you go., Peel and finely slice 2 onions, then place in the large casserole pan on a medium heat with a splash of olive oil and cook for 10 minutes, stirring regularly., Finely chop the stalks from ½ a bunch of fresh coriander (15g), reserving the leaves for later, along with 30g of sun-dried tomatoes, then add to the pan., Stir in 2 tablespoons of Thai curry paste (choose your favourite) and cook for a further 3 minutes, then pour in ½ x 400g tin of light coconut milk and 400ml of boiling kettle water, and mix well., Add the charred veg back into the pan, pop the lid on, reduce the heat to low and cook gently for 10 minutes, throwing the mangetout in for the final 2 minutes., Season with 2 teaspoons of soy or fish sauce, then finely chop and scatter over the coriander leaves., Cut 1 lime into wedges for squeezing over, then serve up, with flatbreads on the side, if you like."
Roasted sweet potato burrito | Jamie Oliver recipes,Black bean sauce & jalapeño salsa,"https://img.jamieoliver.com/jamieoliver/recipe-database/134449899.jpg?tr=w-800,h-1066","['Serves', '4']",In50 minutes,"“Packed with beautiful flavours, this vegan burrito comes with an incredible black bean sauce for optimum dunkage. Hit it up with some vegan yoghurt and jalapeño pickle for the perfect finish. Messy, but oh so good! ”",558,9.6g,2.3g,13.2g,1.5g,17.3g,98.8g,12.5g,"2                                                                                                                                                                medium                                                                                                                                                                sweet potatoes                                                                                                                                                                , (600g), olive oil, 2                                                                                                                                                                cloves of                                                                                                                                                                garlic, ½                                                                                                                                                                a teaspoon of                                                                                                                                                                sweet smoked paprika, ½                                                                                                                                                                a teaspoon of                                                                                                                                                                ground cumin, 1 x 400                                                                                                                                                                g tin of                                                                                                                                                                black beans, 150                                                                                                                                                                g                                                                                                                                                                long grain rice, 200                                                                                                                                                                g                                                                                                                                                                spinach, 6                                                                                                                                                                                                                    spring onions, 100                                                                                                                                                                g                                                                                                                                                                sliced pickled jalapeños, ½                                                                                                                                                                a bunch of                                                                                                                                                                fresh coriander                                                                                                                                                                , (15g), 4                                                                                                                                                                                                                    wholemeal tortillas, 4                                                                                                                                                                tablespoons                                                                                                                                                                diary-free yoghurt, 1-2                                                                                                                                                                                                                    limes","Preheat the oven to 180°C/350°F/gas 4., Cut 600g of sweet potatoes into rough 3cm chunks, then toss in a roasting tin with 1 tablespoon of olive oil and a pinch of sea salt and black pepper. Roast for 40 minutes, or until soft, golden and gnarly., Place a small pan on a medium heat with 1 teaspoon of olive oil., Peel and finely slice 2 cloves of garlic, then add to the pan along with ½ a teaspoon each of sweet smoked paprika and ground cumin. Fry for 1 to 2 minutes, then tip in 1 x 400g tin of black beans (juice and all), plus 1 tin’s worth of water and simmer for 5 minutes., Season to taste, then remove from the heat and blitz with a hand blender until smooth. Return to a low heat and leave to tick away., Meanwhile, cook 150g of long grain rice in a pan of boiling salted water according to the packet instructions, then drain., Place 200g of spinach in a colander above the rice and leave to wilt for a few minutes, then squeeze out any excess water., For the salsa, trim and finely slice 6 spring onions, then place in a bowl with the 100g of sliced pickled jalapeños and a splash of pickling juice. Pick in the leaves from ½ a bunch of fresh coriander (15g) and give everything a good mix., To assemble the burritos, load up the tortillas with the sweet potatoes, rice and spinach, wrap up, then slice in half. Pour the black bean sauce between 4 plates, and arrange the burritos on top. Serve each topped with some jalapeño salsa and 1 tablespoon of dairy-free yoghurt. Cut 1 to 2 limes into wedges for squeezing over."
Grilled & roasted potatoes | Jamie Oliver recipes,"Lemon, garlic & sage","https://img.jamieoliver.com/jamieoliver/recipe-database/127387245.jpg?tr=w-800,h-1066","['Serves', '6']",,,239,5g,0.8g,1.8g,0.4g,5.8g,45.2g,3.2g,"1                                                                                                                                                                bunch of                                                                                                                                                                sage                                                                                                                                                                , (20g), 1 ½                                                                                                                                                                lemons, olive oil, 1                                                                                                                                                                bulb of                                                                                                                                                                garlic, 1.5                                                                                                                                                                kg                                                                                                                                                                potatoes",
Amazing hasselback potatoes | Jamie Oliver recipes,"Special pigs in blankets, walnut & polenta sprinkle","https://img.jamieoliver.com/jamieoliver/recipe-database/128491170.jpg?tr=w-800,h-1066","['a', 'side']",,"“This hasselback potato recipe brings together two of my favourite winter classics: crispy roasties and pigs in blankets. It’s a winner of a Sunday roast side dish, with a couple of optional extras that make this a properly special recipe for your Christmas feast! ”",378,15g,3.8g,2.2g,1.2g,13.8g,49.2g,3.4g,"2                                                                                                                                                                kg                                                                                                                                                                Maris Piper potatoes                                                                                                                                                                , (choose the smallest ones), olive oil, 4                                                                                                                                                                                                                    large higher-welfare sausages                                                                                                                                                                , (400g total), optional sausage stuffers: dates, dried cranberries, mustard, chilli, sage, cheese, pickled onions, 4                                                                                                                                                                rashers of                                                                                                                                                                higher-welfare smoked streaky bacon, optional: small sprigs of rosemary, 2                                                                                                                                                                cloves of                                                                                                                                                                 garlic, 1                                                                                                                                                                tablespoon                                                                                                                                                                polenta, 4                                                                                                                                                                                                                    shelled unsalted walnut halves","TO MAKE THE HASSELBACK POTATOES Preheat the oven to 180°C/350°F/gas 4., Try to choose small potatoes, give them a wash, and if you have any larger ones, cut them in half and use the flat side as a base. To make this process as simple as possible, place a potato on a board between the handles of two wooden spoons, so that when you slice down into the potato the spoons stop the blade from going all the way through. Carefully slice at just under ½cm intervals all the way along. Repeat with all the potatoes, placing them in a large roasting tray as you go., Drizzle with 2 tablespoons of olive oil, season with sea salt and black pepper, and roast for 1 hour, or until the potatoes are golden and tender. Remove and leave to cool., TO MAKE THE PIGS IN BLANKETS Twist each sausage in the middle so you can cut each one in half., Now, for a bit of fun, I like to use a small sharp knife to make an incision into each one, creating a little hole ready to stuff with whatever will elevate your sausages to an even higher level of joy., Cut the bacon rashers in half, then, working one at a time, press the side of your knife across each mini rasher to stretch it out. Place a sausage on each, wrap it up, then skewer with a cocktail stick or a sharpened sprig of rosemary., Nestle the wrapped sausages in among the cool potatoes, then cover and refrigerate overnight., TO SERVE Preheat the oven to 190°C/375°F/gas 5., Peel the garlic and pound up in a pestle and mortar with a small pinch of salt, then mix in the polenta and finely grate in the walnuts. Sprinkle over the potatoes, then drizzle with 1 tablespoon of oil., When the Epic mixed roast comes out, roast the potatoes for 1 hour, or until hot and crisp, and the sausages are golden and cooked through."
Comforting mash | Jamie Oliver recipes,Celeriac & potato,"https://img.jamieoliver.com/jamieoliver/recipe-database/128935930.jpg?tr=w-800,h-1066","['Serves', '10']",,,146,2.7g,1.3g,2.4g,0.2g,4g,27.9g,4.9g,"1.5                                                                                                                                                                kg                                                                                                                                                                 potatoes, 1                                                                                                                                                                                                                    celeriac                                                                                                                                                                , (800g), 25                                                                                                                                                                g                                                                                                                                                                unsalted butter, 2                                                                                                                                                                tablespoons                                                                                                                                                                semi-skimmed milk",
