Recipe title,Subheading,Image (link),Recipe-detail serves,Recipe-detail time,Recipe-detail,Calories,Fat,Saturates,Sugars,Salt,Protein,Carbs,Fibre,Ingred-list,RecipeSteps
Davina McCall's slow-cooked rabbit,Pomme purée & garlicky green beans,"https://img.jamieoliver.com/jamieoliver/recipe-database/83653983.jpg?tr=w-800,h-1066","['Serves', '8']",50 minutes,"“Rabbit is lean, cheap, and delicious, but it’s such an overlooked meat in this country.  I hope this amazing casserole – a favourite from Davina McCall’s childhood years in Paris – will make you think twice. The classic pomme purée recipe uses an insane amount of butter, so I’ve tweaked the quantities to deliver a similar creamy finish only using less of it. Pure indulgence, but what a joy! Bon appétit. ”",633,40.6g,16.6g,5.4g,2g,33.7g,34.9g,5.3g,"RABBIT, olive oil, 150                                                                                                                                                                g                                                                                                                                                                smoked lardons, 20                                                                                                                                                                                                                    shallots, 200                                                                                                                                                                g                                                                                                                                                                chestnut button mushrooms, 2                                                                                                                                                                                                                    rabbits                                                                                                                                                                , (1.2kg), skin off, bone in, jointed, 100                                                                                                                                                                g                                                                                                                                                                plain flour, 4                                                                                                                                                                                                                    bay leaves, ½                                                                                                                                                                a bunch of                                                                                                                                                                fresh thyme                                                                                                                                                                , (15g), tied with string, 1.5                                                                                                                                                                litres                                                                                                                                                                organic chicken stock, POMME PURÉE, 900                                                                                                                                                                g                                                                                                                                                                Maris Piper potatoes, 150                                                                                                                                                                ml                                                                                                                                                                whole milk, 100                                                                                                                                                                ml                                                                                                                                                                 double cream, 100                                                                                                                                                                g                                                                                                                                                                unsalted butter, GREEN BEANS, 400                                                                                                                                                                g                                                                                                                                                                fine green beans, 1                                                                                                                                                                                                                    shallot, ½                                                                                                                                                                a clove of                                                                                                                                                                garlic, ½                                                                                                                                                                a bunch of                                                                                                                                                                fresh tarragon                                                                                                                                                                , (15g), 2                                                                                                                                                                teaspoons                                                                                                                                                                Dijon mustard, red wine vinegar, extra virgin olive oil","For the rabbit, drizzle 1 tablespoon of olive oil into a large deep pan. Add the lardons and fry until golden and crispy. Remove from the pan with a slotted spoon and set aside., Peel the shallots, then add to the pan with another tablespoon of olive oil and the mushrooms. Cook for a few minutes, or until lightly golden, then remove to a plate., Season the rabbit with sea salt and black pepper, then dust with the flour. Drizzle another tablespoon of olive oil into the pan, add the rabbit and cook for 5 to 10 minutes, turning until golden all over – you may need to do this in batches., Add the bay and thyme, then return the lardons, shallots and mushrooms to the pan with any juices. Pour in ¼ of the chicken stock and scrape up any flour from the bottom of the pan, stirring it into the liquid to get rid of any lumps. Stir in the remaining stock, bring to the boil, then reduce the heat to low, cover, and simmer for 30 minutes., Remove the lid and leave to tick away for a further hour, or until the meat is falling away from the bone and the sauce has thickened., For the pomme purée, peel and dice the potatoes into 4cm cubes. Cook in a large pan of salted boiling water for 12 minutes, then drain and leave to steam dry., Heat the milk and cream in a small pan on a low-medium heat, until just below boiling point., Use a spatula to push the potato through a sieve into a bowl, then mix with the butter, warmed milk mixture and a little seasoning, until combined and creamy. You can also do this with a potato ricer or French mouli, if you have one., Trim the green beans and cook in a large pan of salted boiling water for 4-5 minutes, or until tender., Meanwhile, peel and finely chop the shallot, garlic and tarragon. Dollop the mustard into a serving bowl with 3 tablespoons of vinegar. Gradually drizzle in 80ml extra virgin olive oil, whisking continuously until you have a thick dressing. Add the shallots, garlic and tarragon, then whisk again. Have a taste and season to perfection., Drain the beans and add to the dressing hot, tossing to coat., Bring the rabbit, pomme purée and dressed beans to the table and let everyone help themselves to a bit of everything. Delicious!"
Mexican-style steak | Jamie Oliver steak recipes,"Salsa, peanut sauce & crinkle-cut potatoes","https://img.jamieoliver.com/jamieoliver/recipe-database/85128277.jpg?tr=w-800,h-1066","['leftover', 'sauces']",resting time,"“Here’s a meaty treat inspired by Mexico to get your taste buds fired up – a nice juicy steak served with a fresh, crunchy salsa and an addictively rich satay-style sauce. Ask your butcher to cut you a thick, double steak so you can get it gnarly on the outside and blushing on the inside. You can amplify tenderness and keep it juicy by turning it regularly, trapping the moisture inside while building up a bark-like crust. Peel off the fat and use it to render your potatoes for a deliciously retro side. Get in! ”",668,41.2g,11.9g,4.2g,1.3g,41.9g,31.6g,2.9g,"1 x                                                                                                                                                                3cm thick                                                                                                                                                                sirloin steak                                                                                                                                                                , (300g), 1                                                                                                                                                                                                                    Maris Piper potato                                                                                                                                                                , (300g), 3                                                                                                                                                                                                                    fresh green chillies, olive oil, SALSA, ½                                                                                                                                                                a bunch of                                                                                                                                                                fresh coriander                                                                                                                                                                , (15g), ½                                                                                                                                                                a bunch of                                                                                                                                                                fresh mint                                                                                                                                                                , (15g), ½                                                                                                                                                                a                                                                                                                                                                clove of garlic, 1                                                                                                                                                                                                                    fresh red chilli, 2                                                                                                                                                                                                                    spring onions, 1                                                                                                                                                                                                                    ripe tomato                                                                                                                                                                , on the vine, 1                                                                                                                                                                                                                    lime, extra virgin olive oil, PEANUT SAUCE, 50                                                                                                                                                                g                                                                                                                                                                unsalted peanuts, 25                                                                                                                                                                g                                                                                                                                                                sesame seeds, ½                                                                                                                                                                teaspoon                                                                                                                                                                cumin seeds, 1                                                                                                                                                                clove of                                                                                                                                                                garlic, 1                                                                                                                                                                sprig of                                                                                                                                                                fresh thyme, ½                                                                                                                                                                teaspoon                                                                                                                                                                dried oregano, ½                                                                                                                                                                a                                                                                                                                                                 dried smoked chipotle chilli, 1                                                                                                                                                                tablespoon                                                                                                                                                                tequila, 1-2                                                                                                                                                                                                                    limes, ½                                                                                                                                                                a                                                                                                                                                                fresh green chilli","Preheat to the oven to 180°C/350°F/gas 4., Take your steak out of the fridge and let it come up to room temperature., For the salsa, pick and reserve a few coriander leaves, then roughly chop the rest (stalks and all). Pick and roughly chop the mint leaves. Peel the garlic, trim the chilli (deseed if you like) and spring onions, then roughly chop, along with the tomato. Mix with the herbs and continue chopping everything together until very fine., Squeeze the lime juice into a serving bowl with a good lug of of extra virgin olive oil and season with sea salt and black pepper. Add the chopped ingredients and toss to coat in the dressing. Set aside until needed., For the peanut sauce, put the nuts and the sesame and cumin seeds in a large dry frying pan over a medium heat. Peel and roughly slice the garlic and add to the pan, along with the thyme and oregano. Tear in the chipotle chilli and toast for a few minutes until lightly golden., Tip into a blender, just cover with water, then add the tequila, the juice of 1 lime, the fresh chilli, and a pinch each of sea salt and black pepper. Whiz until super-smooth, adding a splash more water if needed. Have a taste and adjust with more salt, chilli or lime juice. Set aside until needed., Scrub the potatoes and cut into 1cm-thick slices with a crinkle-cut knife. Pull the fat off the steak (discard the sinew) and finely slice. Place the fat in a cold non-stick frying pan over a medium heat and cook until golden. Add the potatoes and chillies and cook for 7 to 8 minutes on each side, or until golden and crispy. Tip the potatoes onto a plate lined with kitchen paper and keep warm in the preheated oven., Season the steak with salt and pepper, and place into the same pan as you cooked the potatoes, turning every minute until cooked to your liking – (about 7 minutes for medium rare). Remove from the pan, drizzle with a little oil and leave to rest for a few minutes, then slice 1cm thick., Spread a little peanut sauce over a large serving platter or divide between plates, and place the steak on top., Finish with a few dollops of salsa, a scattering of the reserved coriander, drizzle over any resting juices, then serve up with the crispy potatoes and tuck in."
Roasted root veg | Jamie Oliver Christmas recipes,Sweet garlic & crispy rosemary,"https://img.jamieoliver.com/jamieoliver/recipe-database/83911434.jpg?tr=w-800,h-1066","['Serves', '12']",hour cook),"“We all have our favourite way to roast veg, but this method is a mega time and space saver. For maximum flavour, I’m keeping my carrot and parsnip skins on – try it for yourself and you’ll notice how much sweeter they taste. Pretty damn fabulous! ”",383,6.8g,1g,16.4g,0.6g,9.2g,75.6g,14g,"3                                                                                                                                                                kg                                                                                                                                                                Maris Piper potatoes, 16                                                                                                                                                                                                                    carrots, 12                                                                                                                                                                                                                    parsnips, 1                                                                                                                                                                bulb of                                                                                                                                                                garlic, ½                                                                                                                                                                a bunch of                                                                                                                                                                fresh rosemary                                                                                                                                                                , (15g)",
