Recipe title,Subheading,Image (link),Recipe-detail serves,Recipe-detail time,Recipe-detail,Calories,Fat,Saturates,Sugars,Salt,Protein,Carbs,Fibre,Ingred-list,RecipeSteps
Pan-fried duck breast with spring veg | Jamie Oliver recipes,The perfect way to cook a duck breast,"https://img.jamieoliver.com/jamieoliver/recipe-database/106303004.jpg?tr=w-800,h-1066","['Serves', '2']",In30 minutes,"“Juicy pan-fried duck breast pairs an absolute treat with spring’s bounty of asparagus, new potatoes and peas. With best flavour friends chilli, mint and lemon in the mix, you just know this is going to be delicious.  ”",520,20.2g,4.3g,8.6g,0.9g,47.8g,38.2g,10.2g,"300                                                                                                                                                                g                                                                                                                                                                new potatoes, 1 x 250                                                                                                                                                                g                                                                                                                                                                free-range duck breast, 1                                                                                                                                                                bunch of                                                                                                                                                                asparagus                                                                                                                                                                , (350g), 200                                                                                                                                                                g                                                                                                                                                                fresh or frozen peas, 1                                                                                                                                                                fresh                                                                                                                                                                red chilli, ½                                                                                                                                                                a bunch of                                                                                                                                                                fresh mint                                                                                                                                                                , (15g), 1                                                                                                                                                                                                                    lemon, extra virgin olive oil","Cook the potatoes, halving any larger ones, in a pan of boiling salted water for 20 minutes, or until tender., Meanwhile, score the skin of the duck breast at 2cm intervals, then season with sea salt and black pepper., Place the duck skin-side down in a cold non-stick frying pan, then turn the heat on to medium-high. Cook for 8 minutes without moving it, or until the fat is well rendered and the skin is golden and crispy., Turn the duck over and cook for 4 minutes on the other side, then remove to a plate to rest, leaving the pan of duck fat on the heat., Snap the woody ends off the asparagus and add the spears to the potato pan for the last 5 minutes, adding the peas for the last 2 minutes, then drain it all and leave to stream dry., Finely chop the chilli and mint leaves (reserving a few pretty baby leaves), and place in a large bowl. Finely grate in the lemon zest and squeeze in half the juice, add 1 tablespoon of extra virgin olive oil, mix together and season to perfection., Halve the asparagus spears, then tip all the warm vegetables into the dressing and mix well. Divide between your plates, then slice the duck and arrange over the top. Scatter over the reserved baby mint leaves to finish."
Catherine wheel sausage with watercress champ | Jamie Oliver recipes,Onion & cider gravy,"https://img.jamieoliver.com/jamieoliver/recipe-database/100112118.jpg?tr=w-800,h-1066","['Serves', '6']",In40 minutes,"“I love cooking sausage like this, they go really crunchy with a soft middle. Try them for Bonfire Night! ”",551,27.9g,10.7g,8.7g,1.9g,27.4g,46.8g,4.1g,"10                                                                                                                                                                                                                    Cumberland sausages, 6                                                                                                                                                                                                                    bay leaves, olive oil, 1                                                                                                                                                                kg                                                                                                                                                                Maris Piper potatoes, 300                                                                                                                                                                ml                                                                                                                                                                 full-fat milk, 1                                                                                                                                                                bunch of                                                                                                                                                                watercress                                                                                                                                                                 , (30g), 4                                                                                                                                                                                                                    spring onions, GRAVY, 2                                                                                                                                                                                                                    red onions, 25                                                                                                                                                                g                                                                                                                                                                unsalted butter, 2                                                                                                                                                                sprigs of                                                                                                                                                                fresh rosemary, 2                                                                                                                                                                 tablespoons                                                                                                                                                                plain flour, 1                                                                                                                                                                 litre                                                                                                                                                                organic chicken stock, 250                                                                                                                                                                ml                                                                                                                                                                cider","Preheat the oven to 190°C/375°F/gas 5., Untwist the sausage links and wind them round into a Catherine wheel. Push two skewers through the spiral to secure. Poke in the bay leaves and brush with 1 tablespoon of oil, then transfer to a baking tray and cook for 35 to 40 minutes, or until golden and crispy., Peel and halve the potatoes, then cook in boiling salted water for 15 minutes, or until tender. Drain, then return to the pan and cover, Meanwhile, heat the milk gently in a pan. Roughly chop half of the watercress and trim and finely chop the spring onions. Add them both to the milk and simmer for 5 minutes, or until softened., Add the cooked potatoes to the milk and mash until smooth. Season well with sea salt and black pepper, then cover with a lid and keep warm., To make the gravy, peel and finely slice the onions. Add the butter to a pan over a medium heat and fry the onion and rosemary for 5 minutes, or until the onions are sweet and translucent. Stir in the flour, then add the stock and cider, and simmer until reduced to a thick, tasty gravy., Serve the sausage with the mash, gravy and remaining watercress."
Terrific tornado potatoes | Jamie Oliver recipes,"Parmesan, cumin & smoky paprika","https://img.jamieoliver.com/jamieoliver/recipe-database/100112121.jpg?tr=w-800,h-1066","['Makes', '6']",10 minutes,"“Roast potatoes but not as you know them! These wonderful crunchy potato spirals have an incredible dusting of Parmesan, cumin, garlic powder and smoky paprika.  ”",241,12.3g,3.3g,2.1g,0.6g,2.1g,27.4g,2.1g,"6                                                                                                                                                                medium                                                                                                                                                                 Maris Piper potatoes, olive oil, 50                                                                                                                                                                g                                                                                                                                                                Parmesan cheese                                                                                                                                                                , plus extra for grating, 1                                                                                                                                                                teaspoon                                                                                                                                                                smoked paprika, 1                                                                                                                                                                teaspoon                                                                                                                                                                ground cumin, 1                                                                                                                                                                teaspoon                                                                                                                                                                garlic powder, DIP, 100                                                                                                                                                                ml                                                                                                                                                                natural yoghurt, 1                                                                                                                                                                                                                    lemon","Preheat the oven to 190°C/375°F/gas 5., Carefully insert a metal skewer lengthwise into the end of the potato and gently push it all the way through., Using a sharp knife, make a small cut at one end of the potato until you hit the skewer, then carefully twist the potato round to continue the cut all the way along, creating a spiralised effect., Gently pull out the spirals to ensure even gaps along the length of the skewer, and brush well with 4 tablespoons of olive oil. Repeat with the remaining potatoes., Finely grate the Parmesan into a bowl, then add in the paprika, cumin, garlic powder and a good pinch of sea salt and black pepper. Sprinkle the mixture over the potato spirals and line up on a baking tray. Bake for 50 minutes, or until cooked through and crispy., To make the dip, place the yoghurt in a bowl, finely zest over the lemon and squeeze in half the juice, then mix well. Season to perfection., Finely grate a little extra Parmesan over the potato spirals and serve with the zesty yoghurt for dipping."
"Shakshuka, my style | Jamie Oliver recipes","Chipped potatoes & squash, peppers & fiery rose harissa","https://img.jamieoliver.com/jamieoliver/recipe-database/100021003.jpg?tr=w-800,h-1066","['Serves', '4']",In30 minutes,"“Harissa adds warmth and a ray of much-needed sunshine to my twist on a Middle-Eastern classic. Plus it’s a one-pan wonder, which always makes me happy. ”",219,10.5g,2.2g,11.6g,0.8g,11.3g,22.5g,5.2g,"200                                                                                                                                                                g                                                                                                                                                                potatoes, 200                                                                                                                                                                g                                                                                                                                                                butternut squash, olive oil, 3                                                                                                                                                                                                                    mixed-colour peppers, ½                                                                                                                                                                a bunch of                                                                                                                                                                fresh flat-leaf parsley (15g), 2                                                                                                                                                                cloves of                                                                                                                                                                garlic, 1                                                                                                                                                                teaspoon                                                                                                                                                                fennel seeds, 1                                                                                                                                                                teaspoon                                                                                                                                                                smoked paprika, 1                                                                                                                                                                teaspoon                                                                                                                                                                ground cumin, 1                                                                                                                                                                teaspoon                                                                                                                                                                rose harissa, 1 x 400                                                                                                                                                                g                                                                                                                                                                tin of quality plum tomatoes, 4                                                                                                                                                                large                                                                                                                                                                eggs","Scrub the potatoes and squash (deseed if needed), slice into 1cm-thick chips, then place in a large non-stick frying pan on a medium heat with 1 tablespoon of oil., Deseed and roughly chop the peppers, adding them to the pan as you go., Pick the parsley leaves, finely slicing the stalks. Peel and finely slice the garlic and add to the pan with the parsley stalks, fennel seeds, paprika and cumin, then cover and cook for 10 minutes, stirring regularly., Flick over the harissa and scrunch in the tomatoes, then stir in ¼ of a tin’s worth of water, pop the lid back on and cook for a further 10 minutes, or until the potatoes and squash are soft, stirring occasionally., Remove the lid, stir in the parsley leaves and season with a pinch of sea salt, then cook until the sauce has thickened and reduced., Make 4 wells with the back of a spoon, crack in the eggs, pop the lid on and cook the eggs to your liking. Nice served with warm flatbreads and extra harissa, if you like."
Indian-Indian-style chip butty | Jamie Oliver vegetarian recipes,"Spiced potato, mango & pomegranate chutney, mint yoghurt & sprinkles","https://img.jamieoliver.com/jamieoliver/recipe-database/92507788.jpg?tr=w-800,h-1066","['Serves', '4']",In35 minutes,"“These spiced, crispy hot potato balls squashed into buns with mango and pomegranate chutney, fresh mint yoghurt and Bombay mix sprinkles are to die for. Ridiculously delicious. ”",470,11.4g,5.2g,14g,1.3g,12.8g,84.6g,3.6g,"400                                                                                                                                                                g                                                                                                                                                                potatoes, 400                                                                                                                                                                g                                                                                                                                                                sweet potatoes, 3                                                                                                                                                                cloves of                                                                                                                                                                garlic, 3                                                                                                                                                                cm piece of                                                                                                                                                                ginger, 1                                                                                                                                                                                                                    fresh red chilli, 1                                                                                                                                                                large knob of                                                                                                                                                                unsalted butter, 1                                                                                                                                                                teaspoon                                                                                                                                                                garam masala, 1                                                                                                                                                                teaspoon                                                                                                                                                                mustard seeds, 2                                                                                                                                                                tablespoons                                                                                                                                                                mango chutney, ½                                                                                                                                                                a                                                                                                                                                                pomegranate, 1                                                                                                                                                                bunch of                                                                                                                                                                fresh mint                                                                                                                                                                , (30g), 4                                                                                                                                                                tablespoons                                                                                                                                                                natural yoghurt, 4                                                                                                                                                                                                                    soft rolls, 20                                                                                                                                                                g                                                                                                                                                                Bombay mix","Scrub the potatoes and sweet potatoes and chop into 2cm chunks, cook in a large pan of boiling salted water for 10 minutes, or until tender, then drain and steam dry., Peel the garlic and ginger, finely chop with the chilli, and place in a large non-stick frying pan over a medium heat with the butter, garam masala and mustard seeds., After 1 minute, tip and mash in the potatoes, then season to perfection with sea salt and black pepper. Keep frying until crispy, then mix up and allow to get crispy again., Divide roughly into 4 (still in the pan), then use 2 spoons to crudely mould and shape into balls, patiently frying and turning until kind of rounded, really golden and crispy all over (trust me, these are amazing!)., Spoon the mango chutney into a bowl, squeeze in enough pomegranate juice to loosen, then mix together with a handful of the pomegranate seeds., Whiz the mint leaves in a blender with the yoghurt until smooth. Split the rolls open and lightly toast on the inside, and roughly crush the Bombay mix., Spoon a dollop of mint yoghurt on to each bun base, top with a hot potato ball, a little mango chutney and Bombay mix, then pop the lid on and squash."
