Recipe title,Subheading,Image (link),Recipe-detail serves,Recipe-detail time,Recipe-detail,Calories,Fat,Saturates,Sugars,Salt,Protein,Carbs,Fibre,Ingred-list,RecipeSteps
Salmon and Potato | Fish Recipes | Jamie Oliver Recipes,A brilliant one-tray dinner,"https://img.jamieoliver.com/jamieoliver/recipe-database/oldImages/large/768_1_1436880021.jpg?tr=w-800,h-1066","['Serves', '4']",10 minutes,"“Stuffed salmon with fresh herbs, roasted fennel and spuds is a magic combo, and super easy ”",470,23.3g,6.4g,27g,1.2g,30.4g,36.7g,4.9g,"600                                                                                                                                                                g                                                                                                                                                                waxy new potatoes, 1                                                                                                                                                                large bulb                                                                                                                                                                fennel, sea salt, freshly ground black pepper, 1                                                                                                                                                                bunch                                                                                                                                                                fresh flat-leaf parsley                                                                                                                                                                , leaves picked and finely chopped, 2                                                                                                                                                                cloves                                                                                                                                                                garlic                                                                                                                                                                , peeled and finely chopped or grated, 15                                                                                                                                                                g                                                                                                                                                                butter                                                                                                                                                                , cut into small pieces, olive oil, 4 x 120                                                                                                                                                                g                                                                                                                                                                salmon fillets                                                                                                                                                                , from sustainable sources, ask your fishmonger, scaled and pin-boned, a few                                                                                                                                                                sprigs                                                                                                                                                                fresh mint                                                                                                                                                                , leaves picked and finely chopped, 1                                                                                                                                                                small handful                                                                                                                                                                Parmesan cheese                                                                                                                                                                , grated, 1                                                                                                                                                                                                                    lemon                                                                                                                                                                , zest of","This is a brilliant one-tray dinner. Roasted fennel and potatoes are a magic combination, as are the fresh herbs and salmon. Scoring and stuffing the salmon is a great little trick you can use on any type of fish., Preheat your oven to 220°C/425°F/gas mark 7. Bring a large pan of salted water to the boil. Halve the potatoes lengthways and trim the fennel bulb, reserving the leafy fronds for garnishing later. Cut the fennel bulb into eight wedges, add these to the salted water with the halved potatoes and parboil for around 6 minutes., Drain the vegetables in a colander and leave to steam-dry for a minute. Transfer to a large roasting tray and season well with salt and pepper. Sprinkle over half the chopped parsley and all of the garlic, dot over the butter and drizzle well with olive oil. Toss everything together in the roasting tray, then shake it out so it is in one even layer. Cook in the oven for about 30 minutes, or until golden., While the vegetables are roasting away in the oven, you can start preparing the salmon fillets. Pinch the fillets so they plump up and use the length of a knife to score the skin side of them. You want to score about 1cm down into them. Not only will this help all the lovely flavours get right into the fish, it will also help it cook more quickly. Season both sides of the fish well and stuff the remaining chopped parsley and the mint leaves into the scores. Mint goes brilliantly with oily fish, such as salmon., Once the potatoes are nice and golden, take them out of the oven and sprinkle the grated Parmesan over them. Give everything a bit of a jiggle, then lay the salmon, skin-side up, on top. Sprinkle the lemon zest over the top, drizzle with olive oil then cook for 15 minutes., Just before the salmon comes out of the oven, chop the reserved fennel fronds. Sprinkle them over the finished dish, then serve it in the middle of the table with some wedges of lemon and let everyone tuck in."
Beetroot Gravadlax | Fish Recipes | Jamie Oliver Recipes,With delicious herby horseradish,"https://img.jamieoliver.com/jamieoliver/recipe-database/oldImages/large/745_30_1436801429.jpg?tr=w-800,h-1066","['Serves', '6']",day cure,"“Curing your own salmon is actually pretty easy, and this way gives you a lovely vibrant pink colour ”",452,16.2g,2.9g,9.7g,1.62g,33.7g,36.3g,4.7g,"For the beetroot cure, 2                                                                                                                                                                large                                                                                                                                                                fresh beetroots                                                                                                                                                                , peeled and quartered, 1                                                                                                                                                                                                                    orange                                                                                                                                                                , zest of, 2                                                                                                                                                                                                                    lemons                                                                                                                                                                , zest of, 2                                                                                                                                                                                                                    juniper berries                                                                                                                                                                , bashed, 6                                                                                                                                                                tablespoons                                                                                                                                                                rock salt, 2                                                                                                                                                                tablespoons                                                                                                                                                                demerara sugar, 50                                                                                                                                                                ml                                                                                                                                                                gin, 800                                                                                                                                                                g                                                                                                                                                                side of salmon                                                                                                                                                                , from sustainable sources, ask your fishmonger, For the herb cure, 1                                                                                                                                                                small bunch                                                                                                                                                                fresh dill                                                                                                                                                                , finely chopped, 1                                                                                                                                                                small bunch                                                                                                                                                                fresh tarragon                                                                                                                                                                , leaves picked and finely chopped, 4                                                                                                                                                                tablespoons                                                                                                                                                                freshly grated horseradish, 50                                                                                                                                                                ml                                                                                                                                                                gin, To serve, 1                                                                                                                                                                loaf                                                                                                                                                                brown bread, a few                                                                                                                                                                handfuls                                                                                                                                                                watercress                                                                                                                                                                , washed and spun dry, 1                                                                                                                                                                                                                    lemon                                                                                                                                                                , cut into wedges","This recipe may sound like a lot of work, but curing your own salmon is much easier than you think. You do need to plan ahead, as the flavours need about two days to sink into the salmon properly, but it’s worth the wait., You’ll only spend about 20 minutes doing the actual curing, and you’ll end up with a delicate pink gravadlax which tastes impressive. Although curing is easy, it is important to follow the measurements, so try to get a side of salmon as close as possible to the weight I’ve suggested here. 

For the first cure, blitz the beetroots, orange and lemon zest, and bashed juniper berries in a food processor until you get a fairly smooth paste. Transfer this to a bowl and stir in the rock salt and sugar. Pour in the gin and give it a good mix., Lay the side of salmon skin-side down on a large baking tray and slowly pour over the beetroot cure. Use a spatula to spread it all over the salmon flesh. Once it is all well covered, wrap the salmon in a double layer of greaseproof paper then wrap it tightly with cling film and place it in the fridge for 24 hours., The next day, take the salmon out of the fridge and carefully unwrap it so you can rinse off the cure. Either use 100ml of cold water or gin. Hold the salmon over a baking tray and pour a splash at a time over your salmon. Use a spoon to gently push the beetroot cure off the fish. By now it should have shared its wonderful flavours with the fish and turned it a really vibrant colour. Put the rinsed salmon to one side and run the tray under the tap., For the second cure, mix together the chopped herbs, grated horseradish and gin. Put the salmon back into the clean tray, skin-side down, and pack the herby cure onto the salmon using your hands. Make sure you cover all the flesh – you don’t want any air getting to it. Wrap it again with a double layer of greaseproof paper, then a tight layer of cling film. Pop the salmon back in the fridge for another 24 hours., The next day your salmon will be perfectly cured and ready to eat. You don’t need to rinse off that second cure – simply slice the salmon as finely as you can on an angle so you get gorgeous thin slices of gravadlax tinged with pink and topped with herbs. Pile these onto a plate and serve with a couple of slices of buttered brown bread, and some watercress and wedges of lemon."
Smoked salmon salad recipe | Jamie Oliver fish recipes,A perfect combo of flavours & textures,"https://img.jamieoliver.com/jamieoliver/recipe-database/oldImages/large/735_1_1436887451.jpg?tr=w-800,h-1066","['Serves', '4']",In20 minutes,"“Soft, creamy and crunchy meet sweet and tangy – this avocado salad really does have it all ”",439,24.2g,4.6g,3.5g,3.57g,21.3g,37.8g,4.8g,"1                                                                                                                                                                loaf                                                                                                                                                                ciabatta, 2                                                                                                                                                                small                                                                                                                                                                avocados                                                                                                                                                                , stoned and sliced, 1                                                                                                                                                                                                                    lemon, ½                                                                                                                                                                                                                    cucumber, 2                                                                                                                                                                handfuls                                                                                                                                                                mixed fresh herbs                                                                                                                                                                , leaves picked, 1                                                                                                                                                                punnet                                                                                                                                                                cress                                                                                                                                                                , snipped, 2                                                                                                                                                                tablespoons                                                                                                                                                                mixed seeds (pumpkin, sesame, sunflower and poppy seeds), 1                                                                                                                                                                                                                     blood orange                                                                                                                                                                , halved, extra virgin olive oil, sea salt, freshly ground black pepper, 200                                                                                                                                                                g                                                                                                                                                                smoked salmon                                                                                                                                                                , from sustainable sources, ask your fishmonger","Heat a griddle pan until it is screaming hot – this will take about 5 minutes. Meanwhile, cut the ciabatta in half lengthways, then cut into four equal-sized pieces, about 10–12cm/4–5 inches square., Place the sliced avocado in a bowl and squeeze over some lemon juice to stop it from discolouring. Using a speed peeler or potato peeler, slice the cucumber into long, thin strips on top of the avocado. Add the herbs and cress., Lightly toast the seeds in a dry pan on a medium to low heat, and place to one side to cool. Squeeze a tablespoon of juice out of the blood orange into a bowl, and add 3 tablespoons of extra virgin olive oil. Season it well and give it a mix., Griddle your ciabatta squares in the griddle pan, charring both sides. Once they are nicely toasted, drizzle with a little of the dressing and put to one side. Place a square of ciabatta on each of four plates, then top each with a quarter of the smoked salmon., Drizzle 1 tablespoon of the dressing over the salad and very gently mix with your fingertips. If you feel it needs more dressing, add a little extra, but try not to go overboard – you want it to be very light. Top the smoked salmon with the salad. Finish your delicious starter with a sprinkling of toasted seeds, using half a tablespoon per plate, and garnish with a wedge of blood orange."
