Recipe title,Subheading,Image (link),Recipe-detail serves,Recipe-detail time,Recipe-detail,Calories,Fat,Saturates,Sugars,Salt,Protein,Carbs,Fibre,Ingred-list,RecipeSteps
Fennel Roasted Salmon | Fish Recipes | Jamie Oliver,,"https://img.jamieoliver.com/jamieoliver/recipe-database/8XGiFWd84DgBlBWFs8LxFS.jpg?tr=w-800,h-1066","['Serves', '8']",In30 minutes,"“If you can, use wild salmon, which is at its best at this time of year. It has a deeper, slightly sweeter flavour than the farmed variety and is lovely and pink.  ”",447,33.9g,13.5g,2.5g,,32.4g,3.1g,,"1                                                                                                                                                                tablespoon                                                                                                                                                                fennel seeds, 1 x 1                                                                                                                                                                kg                                                                                                                                                                side of salmon or 2 x 500g wild salmon fillets, scaled and pin-boned, from sustainable sources, 1                                                                                                                                                                                                                    lemon, 6                                                                                                                                                                tablespoons                                                                                                                                                                crème fraîche, 3                                                                                                                                                                tablespoons                                                                                                                                                                freshly grated horseradish (or use from a jar if you can’t find fresh), extra virgin olive oil, 16                                                                                                                                                                                                                    free-range quail eggs or 8 free-range hen eggs, 2                                                                                                                                                                good handfuls of                                                                                                                                                                watercress, ½                                                                                                                                                                a bunch of                                                                                                                                                                fresh dill","Preheat the oven to 180ºC/gas 4., In a pestle and mortar, bash the fennel seeds with a good pinch of sea salt and black pepper., Place the salmon, skin-side down, in a roasting tray and sprinkle the fennel salt over the top. Finely grate over the lemon zest., Bake in the oven for 15 to 20 minutes, or until just cooked, but still a little translucent in the centre (if you’re using wild salmon, reduce the cooking time to 10 to 12 minutes)., Mix the crème fraîche with half the lemon juice, the horseradish, a good lug of oil and a pinch of salt and pepper, to taste. Bring a pan of salted water to the boil., Once the salmon is done, leave to cool a little before removing skin and breaking flesh into chunks., Boil the quail eggs for 2 minutes, or hen eggs for 5½ minutes. Cool in a bowl of cold water then peel carefully., Spoon a dollop of horseradish crème fraîche onto your plates, top with a few pieces of salmon and some watercress. Allocating 2 quail eggs or 1 hen egg per person, cut into halves or quarters and place around the salmon. Finish by picking over the dill and drizzling with extra virgin olive oil."
Spicy salmon tacos | Jamie magazine fish taco recipes,with minty cucumber,"https://img.jamieoliver.com/jamieoliver/recipe-database/46260415.jpg?tr=w-800,h-1066","['Serves', '4']",In30 minutes,,452,16.5g,2.7g,6.8g,1.2g,33.6g,44.6g,2.4g,"4 x 125                                                                                                                                                                g                                                                                                                                                                salmon fillets, skin on, from sustainable sources, 2-3                                                                                                                                                                teaspoons                                                                                                                                                                five spice powder, olive oil, ½                                                                                                                                                                a bunch of                                                                                                                                                                fresh coriander, ½                                                                                                                                                                a bunch of                                                                                                                                                                fresh mint, 150                                                                                                                                                                g                                                                                                                                                                plain fat-free yoghurt, 1                                                                                                                                                                                                                    cucumber, 2                                                                                                                                                                                                                    shallots, 1                                                                                                                                                                                                                    fresh red chilli, 1                                                                                                                                                                tablespoon                                                                                                                                                                white wine vinegar, 1                                                                                                                                                                pinch of                                                                                                                                                                sugar, 4                                                                                                                                                                                                                    corn or flour tortillas","Rub the salmon flesh (but not the skin) with the five spice, a drizzle of oil and a good pinch of sea salt and black pepper., Heat a non-stick frying pan over a medium heat and place the salmon skin-side down in the pan and cook for 8 to 9 minutes or until nearly cooked through and the skin is crispy., Flip them over, immediately remove from the heat and allow to finish cooking through in the residual heat., Save a few coriander sprigs to one side, then pick and finely chop the remaining coriander and the mint leaves. Combine with the yoghurt, and season to taste., Using a speed-peeler, peel the cucumber into ribbons and place in a bowl. Peel and finely slice the shallots and chilli, then add to the bowl. Sprinkle over the vinegar, sugar and a pinch of salt, and mix with your hands to combine the flavours., Place a tortilla on each plate and flake over the salmon fillets, including any crispy skin. Add a dollop of the herby yoghurt, the minty cucumber (squeezing out any liquid) and pick over the reserved coriander leaves. Roll up and enjoy."
Christmas Jerk Gravadlax | Fish Recipes | Jamie Oliver,"With warming spices, rum, chilli and treacle.","https://img.jamieoliver.com/jamieoliver/recipe-database/46260740.jpg?tr=w-800,h-1066","['to', '10']",days curing,"“Curing your own fish is seriously easy, and something you can prep in advance. This spiced version adds a real festive vibe – and guys, if you have enough rum, do use it to rinse off your cure, as it gives the flavour extra depth. This makes a great brunch with some gorgeous bread. ”",290,16.7g,2.9g,0.5g,0.9g,30.6g,1.1g,0.3g,"1.2                                                                                                                                                                kg                                                                                                                                                                side of salmon, from sustainable sources, SPICE CURE, 1                                                                                                                                                                                                                    orange, 1                                                                                                                                                                                                                    scotch bonnet chilli, 1                                                                                                                                                                                                                    shallot, 1                                                                                                                                                                teaspoon                                                                                                                                                                allspice, ½                                                                                                                                                                teaspoon                                                                                                                                                                cinnamon, 1                                                                                                                                                                tablespoon                                                                                                                                                                treacle, 6                                                                                                                                                                tablespoons                                                                                                                                                                rock salt, 2                                                                                                                                                                tablespoons                                                                                                                                                                brown sugar, 2                                                                                                                                                                tablespoons                                                                                                                                                                rum                                                                                                                                                                , plus 50ml extra for rinsing off the cure, HERB CURE, ½                                                                                                                                                                 a bunch of                                                                                                                                                                fresh flat-leaf parsley, ½                                                                                                                                                                a bunch of                                                                                                                                                                fresh thyme, ½                                                                                                                                                                a bunch of                                                                                                                                                                fresh chives","Start curing your salmon three days before. To make the spice cure, zest the orange, trim the chilli and peel the shallot. Blitz the orange zest, allspice, cinnamon, chilli, treacle and shallot in a food processor until you have a smooth paste., Transfer this to a bowl and stir in the rock salt and sugar. Pour in the 2 tablespoons of rum and mix well., Lay a large double layer of greaseproof paper over a baking tray and place the salmon on it, skin-side down. Slowly pour over the spice cure and use a spatula to spread it all over the salmon., Wrap the fish in both layers of the paper, then tightly in clingfilm. Place in the fridge with something heavy on top to weigh it down, then leave for 48 hours., When the time is up, take the salmon out of the fridge and carefully unwrap it. Rinse off the cure with the 50ml of rum (or you can use cold water), holding the salmon over a baking tray and pouring over a splash at a time. Use a spoon to gently push the cure off the fish. It should have shared its wonderful flavours with the salmon and turned it a dark brownish pink., For the herb cure, pick and finely chop all the herbs and mix together in a bowl., Clean the baking tray and cover with two layers of paper as before, then place the salmon on it, skin-side down. Using your hands, pack the herby cure onto the fish, covering all of the flesh – you don’t want air getting in., As before, wrap it with the two layers of greaseproof paper, then a tight layer of clingfilm. Pop it back in the fridge with weights on top and leave for another 24 hours., The next day, your salmon will be perfectly cured and ready to eat. You don’t need to rinse off that second cure – simply slice the salmon diagonally, as thinly as you like, then serve with pickled carrots, chillies, and buttered slices of bread."
Sesame seared salmon | Jamie Oliver recipes,"Dressed mixed grains, carrot ribbons, orange, mint & harissa","https://img.jamieoliver.com/jamieoliver/recipe-database/138602409.jpg?tr=w-800,h-1066","['Serves', '2']",In21 minutes,,640,28.4g,4.6g,17.7g,1g,36.7g,58.2g,9.8g,"2 x 130                                                                                                                                                                g                                                                                                                                                                salmon fillets, skin on, scaled, pin-boned, 2                                                                                                                                                                tablespoons                                                                                                                                                                sesame seeds, 1                                                                                                                                                                bunch of                                                                                                                                                                 mint (30g), 2                                                                                                                                                                                                                    large oranges, extra virgin olive oil, red wine vinegar, 1 x 250                                                                                                                                                                g                                                                                                                                                                packet of cooked mixed grains, 2                                                                                                                                                                                                                    small carrots, 2                                                                                                                                                                heaped teaspoons                                                                                                                                                                harissa",
Salmon Devilled Eggs | Fish Recipes | Jamie Oliver,,"https://img.jamieoliver.com/jamieoliver/recipe-database/6YBLn-VKadJB5UdR4Z1IzV.jpg?tr=w-800,h-1066","['Makes', '16']",In30 minutes,,73,6.4g,1.3g,0g,0.2g,4g,0.1g,0g,"8                                                                                                                                                                large                                                                                                                                                                free-range eggs, 25                                                                                                                                                                g                                                                                                                                                                smoked salmon, 4                                                                                                                                                                sprigs of                                                                                                                                                                fresh dill                                                                                                                                                                , plus extra for serving, 1                                                                                                                                                                pinch of                                                                                                                                                                cayenne pepper, MAYONNAISE, 1                                                                                                                                                                large                                                                                                                                                                free-range egg yolk, 2                                                                                                                                                                teaspoons                                                                                                                                                                Dijon mustard, 1/2                                                                                                                                                                                                                    lemon                                                                                                                                                                , (20ml juice), 100                                                                                                                                                                ml                                                                                                                                                                olive oil, 100                                                                                                                                                                ml                                                                                                                                                                sunflower oil","In a saucepan, cover the eggs with cold water and bring to the boil over a high heat., Simmer for 6 minutes, then drain and pop the eggs in cold water to cool., Peel and halve them lengthways, scoop the yolks into a bowl and roughly mash. Set aside., Make your mayonnaise. In a bowl, whisk the egg yolk, mustard and lemon juice with an electric whisk until frothy., Combine the oils in a jug, then drizzle them into the egg mixture, whisking constantly until combined. Season to taste with sea salt and black pepper., Add 60g of mayo to the egg yolks (refrigerate the rest for up to a few days)., Finely chop and stir in the salmon and dill fronds, then add the cayenne pepper and mash to combine., Spoon into the egg whites, top with extra dill and serve immediately."
