Recipe title,Subheading,Image (link),Recipe-detail serves,Recipe-detail time,Recipe-detail,Calories,Fat,Saturates,Sugars,Salt,Protein,Carbs,Fibre,Ingred-list,RecipeSteps
Jumbo fish fingers | Fish recipes | Jamie Oliver recipes,Golden crispy breadcrumbs,"https://img.jamieoliver.com/jamieoliver/recipe-database/51137579.jpg?tr=w-800,h-1066","['10', 'portions']",plus cooking,"“Something as humble and everyday as a fish finger can be made more nutritious if you make your own, and even better, you can go jumbo in size. I like to use salmon, but white fish works just as well. It's the perfect family favourite to have in the freezer. I’ve used a side of salmon here, but you can absolutely scale this down according to how many fillets you have. Also, have fun with the breadcrumbs, adding different flavours to pimp your ride – we have loads of ideas in the tips below.  ”",359,18.7g,3.8g,0.7g,0.7g,30g,17.3g,1.9g,"1 x 1.2                                                                                                                                                                kg                                                                                                                                                                side of salmon                                                                                                                                                                , skin off, pin-boned, from sustainable sources, 100                                                                                                                                                                g                                                                                                                                                                plain flour, 2                                                                                                                                                                large                                                                                                                                                                free-range eggs, 2                                                                                                                                                                teaspoon                                                                                                                                                                sweet smoked paprika, 200                                                                                                                                                                g                                                                                                                                                                wholemeal bread, 30                                                                                                                                                                g                                                                                                                                                                Cheddar or Parmesan cheese, extra virgin olive oil, 1 x 2½ lbs side of salmon, skin off, pin-boned, from sustainable sources, 2 large free-range eggs, 1 teaspoon sweet smoked paprika, 8 oz whole-grain bread, 1 oz Cheddar cheese, extra virgin olive oil","Cut the fish into 10 x 120g portions. The nature of the shape of the salmon side means that they won’t be uniform in size, but that’s all part of their charm. I tend to cut the side lengthways about 3cm thick, then into chunks from that., Sprinkle the flour across a plate. In a shallow bowl, whisk the eggs with the paprika and a pinch of sea salt and black pepper., Tear the bread into a food processor, grate in the cheese, add 2 tablespoons of oil, season with sea salt and black pepper, and whiz until you have breadcrumbs (see below for some exciting addition ideas), then tip into a baking tray., Turn each fish portion in the flour until evenly coated, dip it in the egg mixture, letting any excess drip off, then turn it in the breadcrumbs until well coated all over. Transfer to a baking tray lined with greaseproof paper, layering them up between sheets of paper until all of the fish is coated., Cook right away or freeze in the tray – once frozen, you can pop them into a tub or sandwich bags for easier storage., To cook, place however many jumbo fish fingers you need on a roasting tray and cook in a preheated oven at 200°C/400°F/gas 6 for 15 minutes from fresh, or 20 minutes from frozen, or until golden and cooked through., Something as humble and everyday as a fish finger can be made even more nutritious if you make your own, and even better, you can go jumbo in size! I like to use salmon but, of course, white fish works well, too., Cut the fish into 10 x 4-oz portions. The nature of the shape of the salmon side means that they won’t be uniform in size, but that’s all part of their charm. I tend to cut the side lengthways about 1¼ inch thick, then into chunks from that., In a shallow bowl, whisk the eggs with the paprika and a pinch of sea salt and black pepper., Tear the bread into a food processor, grate in the cheese, add 2 tablespoons of oil, and whizz until you have bread crumbs, then tip into a tray (this is probably more bread than you need, but it is easier to work with — simply discard whatever’s left)., Coat each fish portion in the egg mixture, let any excess drip off, then turn in the bread crumbs until well coated all over. Transfer to a pan lined with parchment paper, layering them up between sheets of paper until they’re all coated. Cook right away or freeze in the pan — once frozen, you can pop them into a container or sandwich bags for easier storage, To cook, place however many jumbo fish fingers you need on a roasting pan and cook in a preheated oven at 400°F for 15 minutes from fresh, or 20 minutes from frozen, or until golden and cooked through."
Herby smoked salmon poached eggs | Egg recipe | Jamie Oliver recipes,With spinach on thick wholemeal toast,"https://img.jamieoliver.com/jamieoliver/recipe-database/28N1eaJF4U28bo0yyDk9mC.jpg?tr=w-800,h-1066","['Serves', '1']",In15 minutes,“This magic poached egg recipe is super-simple – it's a great trick to have up your sleeve for brekkie. ”,272,13.5g,4g,2.7g,1.2g,16.5g,20.5g,5g,"extra virgin olive oil, a few                                                                                                                                                                                                                    fresh chives, 10                                                                                                                                                                g                                                                                                                                                                smoked salmon                                                                                                                                                                , from sustainable sources, 1                                                                                                                                                                large                                                                                                                                                                free-range egg, 80                                                                                                                                                                g                                                                                                                                                                spinach, 1                                                                                                                                                                thick slice of                                                                                                                                                                 seeded wholemeal bread                                                                                                                                                                , (50g), 1                                                                                                                                                                heaped teaspoon                                                                                                                                                                cream cheese, 1                                                                                                                                                                                                                    lemon, extra virgin olive oil, fresh chives, ⅓ oz smoked salmon, from sustainable sources, 1 large free-range egg, 3oz spinach, 1 thick slice of whole-grain bread with seeds (1¾ oz), 1 heaping teaspoon cream cheese, 1 lemon","Lay a 40cm sheet of non-PVC clingfilm flat on a work surface and rub with a little oil., Finely chop a few fresh chives and sprinkle in the centre of the sheet, then slice and lay over the salmon and carefully crack the egg on top., Pull in the sides of the clingfilm and – very important – gently squeeze out any air around the egg. Twist, then tie a knot in the clingfilm to secure the egg snugly inside., Poach the parcel in a pan of simmering water for 6 to 7 minutes for soft-poached, or until cooked to your liking., Place a colander or bamboo steamer above the pan and wilt the spinach as the egg poaches., Meanwhile, toast the bread and spread the cream cheese on it like butter., Squeeze any excess liquid out of the spinach, then spoon over the toast., Snip open the clingfilm parcel, unwrap the egg and place proudly on top. Serve with a wedge of lemon for squeezing over, then season and tuck in., Lay a 16­-inch sheet of non­-PVC plastic wrap flat on a work surface and rub with a little oil., Finely chop the chives and sprinkle in the center of the sheet, then slice and lay over the smoked salmon and carefully crack the egg on top., Pull in the sides of the plastic wrap and—very important—gently squeeze out any air around the egg. Twist, then tie a knot in the plastic wrap to secure the egg snugly inside., Poach the parcel in a pan of simmering water for 6 to 7 minutes for soft­-poached, or until cooked to your liking., Place a colander or bamboo steamer above the pan and wilt 3 oz of spinach as the egg poaches., Meanwhile, toast the bread and spread the cream cheese on it like butter. Squeeze any excess liquid out of the spinach, then spoon over the toast., Snip open the plastic wrap parcel, unwrap the egg, and place proudly on top. Serve with a wedge of lemon for squeezing over, then season and tuck in."
Griddled salmon with herby quinoa | Seafood recipes | Jamie magazine,,"https://img.jamieoliver.com/jamieoliver/recipe-database/46426423.jpg?tr=w-800,h-1066","['Serves', '4']",,,363,20.8g,4.3g,4.8g,0.21g,32g,11.5g,1.2g,"160                                                                                                                                                                g                                                                                                                                                                ready-to-eat quinoa, 2                                                                                                                                                                                                                    lemons, 2                                                                                                                                                                                                                    courgettes, 1                                                                                                                                                                bulb of                                                                                                                                                                fennel, 1                                                                                                                                                                bunch of                                                                                                                                                                mixed fresh soft herbs, such as dill, parsley, basil, 4                                                                                                                                                                tablespoons                                                                                                                                                                natural yoghurt, extra virgin olive oil, 4                                                                                                                                                                                                                    salmon fillets                                                                                                                                                                , skin on, scaled and pin-boned, from sustainable sources","Prepare the quinoa according to the packet instructions, then squeeze over the juice of half a lemon. Season with a good pinch of sea salt and black pepper, then set aside., Preheat a griddle pan to high., Slice the courgettes lengthways into thin strips. Griddle the courgette strips for 2 minutes each side and put aside on a plate. Turn the griddle down to a medium heat., Using a mandolin (use the guard!) or speed-peeler, slice the fennel into thin strips, place in a bowl and squeeze over the juice of half a lemon. Pick and finely chop the herb leaves, stir through the quinoa and season., Make a dressing by squeezing the remaining lemon juice into a small bowl, then add the yoghurt and 2 tablespoons of oil, and stir to combine. Season with salt and pepper to taste., Season and rub a little oil all over the salmon fillets, then cook on the hot griddle for 3 to 4 minutes each side, or until the fish is cooked through., Pile the quinoa on a plate and arrange the griddled courgette and lemony fennel on top, along with flakes of salmon. Dot over the yoghurty dressing, scatter over the remaining herbs, then serve."
Salmon & prawn fish pie | Jamie Oliver recipes,Sweet potato & spud mash,"https://img.jamieoliver.com/jamieoliver/recipe-database/134584620.jpg?tr=w-800,h-1066","['Serves', '6']",20 minutes,"“Both salmon and prawns are super-high in vitamin B12, which we need for psychological function, meaning we can think properly, and salmon is a source of heart-healthy fats, too. ”",537,17.8g,6g,16g,1.5g,39g,58.2g,9.6g,"streaky bacon, olive oil, 1                                                                                                                                                                large                                                                                                                                                                carrot, 1                                                                                                                                                                bunch of                                                                                                                                                                spring onions, ½                                                                                                                                                                a bunch of                                                                                                                                                                fresh flat-leaf parsley                                                                                                                                                                , (15g), 2                                                                                                                                                                tablespoons                                                                                                                                                                plain flour, 600                                                                                                                                                                ml                                                                                                                                                                semi-skimmed milk, 2                                                                                                                                                                teaspoons                                                                                                                                                                English mustard, 400                                                                                                                                                                g                                                                                                                                                                frozen chopped spinach, 4 x 120                                                                                                                                                                g                                                                                                                                                                salmon fillets                                                                                                                                                                , skin off, pin-boned, from sustainable sources, 200                                                                                                                                                                g                                                                                                                                                                raw peeled prawns                                                                                                                                                                , from sustainable sources, 400                                                                                                                                                                g                                                                                                                                                                frozen peas, 125                                                                                                                                                                g                                                                                                                                                                feta cheese, 600                                                                                                                                                                g                                                                                                                                                                sweet potatoes, 600                                                                                                                                                                g                                                                                                                                                                potatoes","Preheat the oven to 180ºC/350ºF/gas 4., Finely slice 1 rasher of bacon and place in a large roasting tray (30cm x 35cm) with 1 teaspoon of oil, then put on a medium heat (starting from cold helps the fat to render out of the bacon)., Wash and trim 1 large carrot and 1 bunch of spring onions, chop into 1cm dice, and once the bacon is lightly golden, stir them into the tray. Finely slice and stir in the stalks from ½ a bunch of fresh flat-leaf parsley. Cook for 10 minutes, to soften, stirring regularly, then stir in 2 tablespoons of plain flour., Gradually pour in 600ml of semi-skimmed milk, bring up to a good simmer, then stir in 2 teaspoons English mustard and 400g of frozen chopped spinach. Simmer for 5 to 10 minutes, or until the spinach has thawed., Chop 4 salmon fillets into bite-sized chunks, halve 200g of raw peeled prawns, finely chop the parsley leaves and stir it all through the sauce with 400g of frozen peas, then crumble 125g of feta over the top and turn the heat off., Meanwhile, wash 600g each of sweet potatoes and spuds (leaving the skins on for extra nutritional benefit) and chop into 3cm chunks. Cook in a large pan of boiling salted water for 15 minutes, or until cooked through, then drain and mash well, taste, and season to perfection., Gently spoon the mash over the fish pie filling, spreading it out with a fork. Bake for 40 minutes, or until golden and crisp on top, and bubbling at the edges."
