Recipe title,Subheading,Image (link),Recipe-detail serves,Recipe-detail time,Recipe-detail,Calories,Fat,Saturates,Sugars,Salt,Protein,Carbs,Fibre,Ingred-list,RecipeSteps
Fish in crazy water | Jamie Oliver recipes,Acqua pazza – the ultimate island fish dish,"https://img.jamieoliver.com/jamieoliver/recipe-database/77638951.jpg?tr=w-800,h-1066","['Serves', '2']",In30 minutes,"“I’m excited to share this fantastic method that shows just how easy it can be to cook whole fish, on the bone, giving better flavour and succulence, plus it’s harder to overcook the fish and you should also find it’s better value. Everything really gives to everything on the flavour front in this dish – it’s a beautiful thing! ”",407,17.3g,1.6g,10.1g,0.8g,40.3g,11.6g,3.3g,"2                                                                                                                                                                                                                    spring onions, ½                                                                                                                                                                a bulb of                                                                                                                                                                fennel, 1                                                                                                                                                                                                                    carrot, 200                                                                                                                                                                g                                                                                                                                                                ripe mixed-colour cherry tomatoes                                                                                                                                                                , on the vine, 3                                                                                                                                                                cloves of                                                                                                                                                                garlic, ½                                                                                                                                                                a                                                                                                                                                                fresh red chilli, 8-10                                                                                                                                                                                                                    mixed olives                                                                                                                                                                , (stone in), olive oil, 2 x 350                                                                                                                                                                g                                                                                                                                                                whole round fish                                                                                                                                                                , such as royal bream, trout, sea bass, red mullet, scaled, gutted, gills removed, from sustainable sources, 1                                                                                                                                                                bunch of                                                                                                                                                                mixed fresh soft herbs (30g)                                                                                                                                                                , such as flat-leaf parsley, mint, fennel tops, 150                                                                                                                                                                g                                                                                                                                                                Greco di Tufo white wine, 1                                                                                                                                                                                                                    lemon, extra virgin olive oil",
Thai-style crispy sea bass | Fish recipes | Jamie Oliver recipes,"With fresh & zingy lime, coriander & spring onions","https://img.jamieoliver.com/jamieoliver/recipe-database/64975515.jpg?tr=w-800,h-1066","['Serves', '2']",In19 minutes,,410,28.1g,4.8g,1.2g,1.5g,37.4g,2.1g,0.2g,"4                                                                                                                                                                                                                    spring onions, ½                                                                                                                                                                a bunch of                                                                                                                                                                fresh coriander                                                                                                                                                                , (15g), 2 x 300                                                                                                                                                                g whole                                                                                                                                                                sea bass                                                                                                                                                                , scaled, gutted, trimmed, from sustainable sources, 2                                                                                                                                                                tablespoons                                                                                                                                                                Thai red curry paste, 1                                                                                                                                                                                                                    lime","Trim and halve the spring onions, finely shred lengthways and place in a bowl of ice-cold water to crisp up. Pick in the coriander leaves, reserving the stalks., Place a large non-stick frying pan on a medium-high heat., With a sharp knife, score the sea bass skin at 2cm intervals, then rub all over with the curry paste, inside and out, getting into all the cracks and crannies., Pack the coriander stalks into the cavities, season with sea salt and black pepper, then place in the hot pan with 1 tablespoon of olive oil., Cook for 3 to 4 minutes per side, or until dark golden and cooked through (depending on the thickness of your fish)., Drain and shake off the spring onions and coriander and pile on to your plates., Sit the sea bass on top, spooning over any spicy oil from the pan. Finely grate over the lime zest, and serve with lime halves, for squeezing over."
Sea bass recipe | Jamie Oliver recipes,Stuffed with prawns & served with salsa verde,"https://img.jamieoliver.com/jamieoliver/recipe-database/oldImages/large/1411_1_1436885058.jpg?tr=w-800,h-1066","['Serves', '4']",15 minutes,“A great alternative to a classic roast dinner – this fish recipe is a guaranteed show-stopper. ”,954,57.6g,19.2g,2.4g,,61.3g,70.7g,,"60                                                                                                                                                                g                                                                                                                                                                small cooked prawns, 2                                                                                                                                                                tbsp                                                                                                                                                                tarragon                                                                                                                                                                , finely chopped, 1                                                                                                                                                                tbsp                                                                                                                                                                olive oil                                                                                                                                                                , plus extra for greasing, 1                                                                                                                                                                large                                                                                                                                                                free-range egg                                                                                                                                                                , beaten, 2                                                                                                                                                                tbsp                                                                                                                                                                milk, plain flour                                                                                                                                                                , for dusting, 500                                                                                                                                                                g                                                                                                                                                                puff pastry                                                                                                                                                                , halved, 1                                                                                                                                                                kg                                                                                                                                                                whole sea bass                                                                                                                                                                , filleted (ask your fishmonger to do this), green salad                                                                                                                                                                , to serve, SALSA VERDE, 1                                                                                                                                                                small bunch of                                                                                                                                                                basil                                                                                                                                                                , leaves picked, 1                                                                                                                                                                small bunch of                                                                                                                                                                mint                                                                                                                                                                , leaves picked, 1                                                                                                                                                                small bunch of                                                                                                                                                                flat-leaf parsley                                                                                                                                                                , leaves picked, 2                                                                                                                                                                cloves of                                                                                                                                                                garlic, 6                                                                                                                                                                                                                    cornichons, 2                                                                                                                                                                tbsp                                                                                                                                                                capers                                                                                                                                                                , drained, 5                                                                                                                                                                tbsp                                                                                                                                                                anchovy fillets                                                                                                                                                                , drained, 5                                                                                                                                                                tbsp                                                                                                                                                                olive oil, 1                                                                                                                                                                tbsp                                                                                                                                                                red wine vinegar","Preheat the oven to 220ºC/450ºF/gas 7. Combine the prawns, tarragon and olive oil in a small bowl and season generously. For the egg wash, whisk the egg and milk in a small bowl and set aside., Lightly flour a work surface and roll out half of the pastry to a rectangular shape about 5mm thick and 10cm longer than the fish fillets (for the head and tail). Transfer to a lightly oiled baking tin., Place one of the fillets, skin-side down, on the pastry, leaving a little more space at one end for the tail shape. Spoon the prawn and tarragon mixture over the fish and place the other fillet on top. Brush the edges of the pastry with the egg wash., Roll out the remaining pastry to the same size and use this to cover the fish, pressing the edges carefully to seal them. Use a small, sharp knife to trim the excess and create your fish shape. Then, with a teaspoon, score half-moon shapes into the pastry in the style of fish scales (but don’t pierce the pastry)., Roll the off-cut pastry to 1cm thick, cut out a few thin strips to shape into fins, and tear off a small piece and roll into a ball for the fish’s eye. Build your fish shape, brush with the remaining egg wash, then bake for 15 minutes. Reduce the oven temperature to 220ºC/350ºF/gas 4 and cook for another 20 minutes, until the pastry is golden and the fish is cooked., Meanwhile, make the salsa verde. Roughly chop the herb leaves in the centre of a large chopping board. Add the garlic, cornichons, capers and anchovies and continue chopping until fine, mixing it together as you go. Transfer to a bowl, stir in the olive oil and vinegar, and season well., To serve, transfer the fish to a platter and serve in slices with the salsa verde and salad."
"Sea bass, fennel and grapefruit ceviche | Jamie magazine",With a hit of chilli,"https://img.jamieoliver.com/jamieoliver/recipe-database/oldImages/large/1237_1_1436885379.jpg?tr=w-800,h-1066","['Serves', '4']",In15 minutes,"“Ceviche is ideal dinner party food: it tastes amazing, looks impressive and is super-easy to make ”",210,5.3g,0.7g,13.3g,1.29g,27.2g,14.1g,5.6g,"500                                                                                                                                                                g                                                                                                                                                                seabass                                                                                                                                                                , scaled, filleted and pin-boned, from sustainable sources, 2                                                                                                                                                                                                                    fresh red chillies, 1                                                                                                                                                                clove of                                                                                                                                                                garlic, 2                                                                                                                                                                                                                    lemons, 2                                                                                                                                                                                                                    pink grapefruit, 2                                                                                                                                                                bulbs of                                                                                                                                                                fennel, ½ a bunch of                                                                                                                                                                fresh mint                                                                                                                                                                , (15g), extra virgin olive oil","Slice the fish into 1cm strips, place in a bowl and pop in the fridge., Halve, deseed and chop the chillies into 1cm rounds. Peel and grate or finely chop the garlic, then place in a separate bowl or jam jar. Mix in the lemon juice and 1 teaspoon of sea salt, then pop in the fridge., Cut the top and bottom off the grapefruit, carefully peel away the skin, then separate them into segments and put these in a bowl, squeezing the juice from a few segments into the bowl., Reserving the bushy tops, trim and cut the fennel into thin wedges. Pick the mint leaves., When you're ready to eat, get the fish out of the fridge and combine it with the fennel, grapefruit and most of the mint leaves. Give the marinade in the bowl or jam jar a mix, then pour the juices over the fish mixture. Delicately toss together and leave for 2 minutes 30 seconds., Serve simply on a big platter, with the remaining mint leaves and the fennel tops sprinkled over, adding a little drizzle of oil and a few grinds of black pepper."
