Recipe title,Subheading,Image (link),Recipe-detail serves,Recipe-detail time,Recipe-detail,Calories,Fat,Saturates,Sugars,Salt,Protein,Carbs,Fibre,Ingred-list,RecipeSteps
Peruvian ceviche | Seafood recipes | Jamie Oliver recipe,"White fish, lemon, chilli, onion, herbs","https://img.jamieoliver.com/jamieoliver/recipe-database/oldImages/large/992_1_1438787901.jpg?tr=w-800,h-1066","['Serves', '4']",In20 minutes,"“During my time in New York I got to visit all sorts of wonderful and fascinating places, and on one occasion I was lucky enough to be taken to an illegal Peruvian restaurant – it was great fun. This ceviche was on the menu that night. Ceviche is a lovely little appetizer of fresh fish marinated in citrus juices. As long as you’ve got mega fresh fish it’s an absolute dream and delight to make and eat. ”",146,6.4g,1g,1.8g,,20g,2g,,"1                                                                                                                                                                                                                    red or yellow pepper, 2                                                                                                                                                                                                                    spring onions, 400                                                                                                                                                                g                                                                                                                                                                skinless sea bass, lemon sole or snapper                                                                                                                                                                , pinboned, from sustainable sources, juice of 3                                                                                                                                                                                                                    lemons, 1-2                                                                                                                                                                                                                    fresh red chillies, 8                                                                                                                                                                sprigs of                                                                                                                                                                fresh mint, 8                                                                                                                                                                sprigs of                                                                                                                                                                fresh coriander, 1                                                                                                                                                                punnet of                                                                                                                                                                mustard cress, a few                                                                                                                                                                                                                    fennel tops                                                                                                                                                                , (optional), extra virgin olive oil","Deseed and very finely chop the pepper, and trim and finely slice the spring onions, then add to a bowl., Slice the fish into 1cm cubes, add to the bowl, then cover and place in the fridge until needed., Squeeze the lemon juice into a jam jar, add 1 teaspoon of sea salt, then seseed, finely chop and add the chilli., Pop the lid on and place in the fridge to chill – this may seem like a lot of salt but most of it gets drained away. Pick the herbs and cress, and place in the fridge., You can assemble the ceviche just before your guests are ready to eat, but it’s important that you don’t leave the fish marinating for too long – you don’t want the acids in the juices to cook the fish. Pour the lemon dressing over the fish mixture and immediately mix it up. Leave it to sit for about 2½ minutes while you lay out the plates., Throw most of the herb mixture into the bowl with the fish and very quickly toss it together – no more than 10 seconds., Divide the ceviche between 4 plates, gently spoon over a little of the dressing (discarding the rest) and sprinkle with the remaining herbs., Drizzle over a little oil from a height, sprinkle with freshly ground black pepper, and enjoy."
Cajun blackened fish steaks | Seafood recipes | Jamie Oliver,Coated in badass bold spices,"https://img.jamieoliver.com/jamieoliver/recipe-database/oldImages/large/963_1_1433952568.jpg?tr=w-800,h-1066","['Serves', '4']",In15 minutes,“This bold and seriously spicy rub fragrantly flavours the fish in my version of this classic Southern dish. Get grilling! ”,213,11g,1g,0.3g,1.2g,26.8g,1.6g,5.1g,"4 x 200                                                                                                                                                                g                                                                                                                                                                white fish fillets, such as sea bass, snapper, bream or pollock (approx. 2cm thick)                                                                                                                                                                , skin on, scaled and pinboned, from sustainable sources, 1                                                                                                                                                                                                                    lemon, RUB, 10                                                                                                                                                                sprigs of                                                                                                                                                                fresh thyme                                                                                                                                                                , leaves picked, 4                                                                                                                                                                sprigs of                                                                                                                                                                fresh oregano                                                                                                                                                                , leaves picked, 2                                                                                                                                                                                                                    cloves of garlic                                                                                                                                                                , peeled, 2                                                                                                                                                                level teaspoons of                                                                                                                                                                smoked paprika, 1                                                                                                                                                                teaspoon                                                                                                                                                                cayenne pepper, 2                                                                                                                                                                tablespoons                                                                                                                                                                olive oil, 1                                                                                                                                                                                                                    lemon","This is my version of a classic Southern dish, but just a word of warning: it is seriously spicy! The way I heard it, this brilliant rub was invented by an African-American chef working at Commander’s Palace, a posh New Orleans restaurant. The famous head chef there, Paul Prudhomme, took this recipe, added his own little tweaks and introduced blackened fish to the rest of the world. Basically it’s a bold rub that fragrantly flavours fish and meat and goes dark when it cooks, thanks to the paprika and garlic., Traditionally this dish has been made with the locally caught redfish, but it’s also great with any whole or filleted white fish. It goes with so many things, including chicken, pork, lamb and steak. When I was in Louisiana I cooked it on a barbecue, but I’ve shown you below how to do it indoors in a pan. Don’t be scared by how black the spices go: they’ll look burnt but the taste will be amazing., To make the rub, bash up your fresh herbs and garlic in a pestle and mortar until you've got a nice coarse paste. Mix in the spices, 1 teaspoon of sea salt, 1 level tablespoon of black pepper and the olive oil, then squeeze in the juice of half the lemon, making sure not to let any pips get in there, and stir well., Lightly score the skin of your fish in lines about 2cm apart. Using your fingers, smear the rub all over both sides of the fish and into the cuts you've made. Put a non-stick pan or griddle pan over a medium-high heat and let it get nice and hot. Place your fish in the pan, skin side down, and let it cook for 3 to 4 minutes. It will get quite smoky, so you might want to open a window! Turn the heat down to low, then, very carefully, flip your fish over and cook for another 3 to 4 minutes on the second side., Cut your remaining lemon half and your second lemon into wedges for squeezing over. Serve them with your fish, a nice salad and boiled or steamed new potatoes dressed in good olive oil or butter. Don’t forget a nice cold glass of wine!"
Asian-steamed sea bass | Fish recipes | Jamie Oliver recipes,"Ginger, chilli & zingy lime","https://img.jamieoliver.com/jamieoliver/recipe-database/oldImages/large/956_36_1434037341.jpg?tr=w-800,h-1066","['Serves', '2']",In45 minutes,"“Cooking a whole fish is much easier than you might think – stuff  with beautiful fragrant herbs, chilli and ginger for fantastic flavour inside and out! ”",410,11g,0.5g,3g,1.5g,70g,4g,1.6g,"1 x 1.5                                                                                                                                                                kg                                                                                                                                                                whole sea bass                                                                                                                                                                , scaled, gutted, gills removed, from sustainable sources, 5                                                                                                                                                                                                                    spring onions, 1                                                                                                                                                                                                                    fresh red chilli, 5                                                                                                                                                                cm                                                                                                                                                                piece of ginger, 1                                                                                                                                                                bunch of                                                                                                                                                                 fresh coriander                                                                                                                                                                , (30g), 1                                                                                                                                                                                                                    lime, low-salt soy sauce, sesame oil","Score the sea bass on both sides at 2cm intervals, cutting roughly 1cm deep, then place into the steamer tray of your oven (or see tip). Season the inside and both sides of the fish lightly with sea salt., Trim the spring onions and chilli (deseed if you like), then finely slice. Peel and finely chop the ginger, then pick the coriander leaves and finely slice the stalks., Mix the spring onions, chilli, ginger, coriander stalks and most of the leaves together on a board, then stuff and push into the cavity and scores in the fish., Squeeze over the lime juice, adding the squeezed lime halves to the tray. Hit it up with a splash of soy sauce, then cover with the lid., Fill the steamer pocket on the front of the oven with around 1 litre of water, then slot the steamer tray into the bottom of the oven so that the metal nozzle on the tray engages with the back of the oven. Set to steam for around 25 minutes, or until cooked to perfection., Serve on a bed of fluffy rice, drizzled with the juices from the bottom of the steamer tray, a drizzle of sesame oil and the remaining coriander leaves sprinkled over."
Stuffed Sea Bass | Fish Recipes | Jamie Oliver Recipes,,"https://img.jamieoliver.com/jamieoliver/recipe-database/oldImages/large/564_1_1350909025.jpg?tr=w-800,h-1066","['Serves', '2']",In50 minutes,,951,52.3g,15.2g,13g,1.8g,55.5g,52.6g,8g,"2                                                                                                                                                                whole                                                                                                                                                                sea bass                                                                                                                                                                , from sustainable sources, ask your fishmonger, cleaned and gutted, head and tail on, 1                                                                                                                                                                whole                                                                                                                                                                fennel, 1                                                                                                                                                                teaspoon                                                                                                                                                                fennel seeds, 2                                                                                                                                                                cloves                                                                                                                                                                garlic, 50                                                                                                                                                                ml                                                                                                                                                                olive oil, 35                                                                                                                                                                g                                                                                                                                                                butter, ½                                                                                                                                                                a bunch of                                                                                                                                                                fresh dill, ½                                                                                                                                                                a bunch of                                                                                                                                                                fresh flat-leaf parsley, ½                                                                                                                                                                a bunch of                                                                                                                                                                fresh basil, ½                                                                                                                                                                a bunch of                                                                                                                                                                fresh mint, 10                                                                                                                                                                                                                    baby potatoes, 20                                                                                                                                                                                                                    capers, 1                                                                                                                                                                                                                    lemon, 200                                                                                                                                                                ml                                                                                                                                                                white wine, 200                                                                                                                                                                g                                                                                                                                                                tomato and basil sauce","Preheat the oven to 190°C/375°F/gas 5. Finely slice the whole fennel, peel and finely slice the garlic and lightly crush the fennel seeds. Place a medium pan over a medium heat and add the olive oil and half the butter. Once hot, add the fennel and fennel seeds and fry gently for around 5 minutes. Add the garlic and continue cooking for around 5 minutes, or until the fennel is soft, golden brown and sweet. Set aside to cool., Meanwhile, place a medium pan over a high heat and cook the potatoes for around 5 minutes, or until parboiled. Drain and set aside. Finely chop all the herbs together and add to a bowl along with remaining butter, then mix well until combined and set aside. Ensure the sea bass is clean inside and out, pat dry with kitchen paper and make 3 diagonal cuts into one side of the fish down to the bone. Stuff the cuts with the herb butter and fill the cavity of each fish with 2 slices of lemon and the cooked fennel., Gently transfer the fish to the inside of the foil bag or onto the foil. Add in the whole potatoes, capers, tomato sauce and white wine. Seal the foil bag at the end or, if you're using foil, fold it up like a parcel., Place the foil bags onto a baking tray and pop into the oven. Bake for 20-25 minutes, or until cooked through. Remove from the oven and allow to sit for 2-3 minutes, then place onto a serving plate, carefully open and enjoy with a crisp green salad or steamed vegetables."
