Recipe title,Subheading,Image (link),Recipe-detail serves,Recipe-detail time,Recipe-detail,Calories,Fat,Saturates,Sugars,Salt,Protein,Carbs,Fibre,Ingred-list,RecipeSteps
Susan's seafood gumbo | Jamie Oliver recipes,"King prawns, langoustines, sea bass & cockles","https://img.jamieoliver.com/jamieoliver/recipe-database/118227284.jpg?tr=w-800,h-1066","['Serves', '8']",30 minutes,"“Inspired by the one and only legendary US chef Leah Chase, this spicy New Orleans classic is the ultimate surf & turf. A dark roux is key here, plus the ‘holy trinity’ base of onions, peppers and celery. Feel free to substitute the prawns with crayfish, and use any other type of cured sausage you like. It’s seriously good – pure comfort in a bowl.  ”",583,36g,13g,6.2g,2.8g,45.9g,19.7g,3.1g,"1.5                                                                                                                                                                litres of                                                                                                                                                                organic chicken or beef stock, 16                                                                                                                                                                large                                                                                                                                                                raw shell-on king prawns                                                                                                                                                                , from sustainable sources, 500                                                                                                                                                                g                                                                                                                                                                quality smoked spicy sausage                                                                                                                                                                , such as Andouille, olive oil, 50                                                                                                                                                                g                                                                                                                                                                unsalted butter, 5                                                                                                                                                                heaped tablespoons                                                                                                                                                                plain flour, 2                                                                                                                                                                large                                                                                                                                                                green peppers, 1                                                                                                                                                                large                                                                                                                                                                onion, 3                                                                                                                                                                sticks of                                                                                                                                                                celery, 5                                                                                                                                                                                                                    fresh bay leaves, 1                                                                                                                                                                bunch of                                                                                                                                                                fresh thyme                                                                                                                                                                , (30g), 8                                                                                                                                                                cloves of                                                                                                                                                                garlic, 1                                                                                                                                                                teaspoon                                                                                                                                                                cayenne pepper, 1                                                                                                                                                                teaspoon                                                                                                                                                                 Tabasco sauce, 1 x 400                                                                                                                                                                g tin of                                                                                                                                                                quality plum tomatoes, 200                                                                                                                                                                g                                                                                                                                                                green beans, 1                                                                                                                                                                bunch of                                                                                                                                                                fresh curly parsley                                                                                                                                                                , (30g), 600                                                                                                                                                                g                                                                                                                                                                sea bass fillets                                                                                                                                                                , skin on, scaled and pin-boned, from sustainable sources, 4                                                                                                                                                                                                                    fresh langoustines                                                                                                                                                                , from sustainable sources (optional), 300                                                                                                                                                                g                                                                                                                                                                fresh cockles or clams                                                                                                                                                                , cleaned, from sustainable sources, 1                                                                                                                                                                                                                    lemon","Warm the stock in a pan over a low heat. Peel the prawns (keeping the tails on), throwing the heads and shells into the stock pan as you go. Run the tip of a knife down the backs of the prawns and pull out and discard the dark veins, then score a little deeper so they butterfly as they cook., Slice the sausage into rough chunks, place in a large casserole pan on a medium-high heat with 1 tablespoon of olive oil, then cook for 10 minutes, or until it has released its tasty fat., Turn down the heat to low, then remove the sausage to a plate, leaving the fat behind in the pan. Stir the butter and flour into the pan, really scraping up all the sticky bits from the bottom. Continue stirring for 15 to 20 minutes (be patient!), or until dark golden brown – think peanut butter, but you can take it even darker, if you prefer (see tip). You want the roux to have a semi-loose, doughy consistency, so add a splash of oil if there isn’t a lot of fat., Deseed the peppers, peel the onion and roughly chop with the celery, then stir into the roux pan (this is called the holy trinity). Scrunch and add the bay leaves and strip in the thyme leaves, then peel, finely chop and add the garlic, followed by the cayenne and Tabasco., Put the sausage back into the pan, then scrunch in the tomatoes using clean hands, stirring as you go. Ladle the stock through a sieve into the pan, then let it blip away for 10 minutes., Trim the green beans, slice each into three pieces, then add to the pan and cook for 6 minutes. Meanwhile, pick and finely chop the parsley., Slice the sea bass fillets lengthways into thin strips, then halve the langoustines and crack the claws (if using). Sort through the cockles or clams and tap them – if any stay open, throw them away., Add all the fish and seafood to the pan and simmer for a few minutes, or until perfectly cooked – the prawns should be pink and the clams or cockles open (discard any that remain closed), stirring regularly., Squeeze over lemon juice to taste, and scatter with the chopped parsley. Delicious served with fluffy rice."
Malaysian-style whole fish | Jamie Oliver recipes,"Sea bass, coconut rice, chilli pickle & shredded rainbow salad","https://img.jamieoliver.com/jamieoliver/recipe-database/117867077.jpg?tr=w-800,h-1066","['Serves', '4']",In1 hour,"“It’s really worth sourcing a banana leaf for this spectacular Friday Night sea bass dish. Incredible fragrance, amplified flavour and wonderful texture – it’s a real belter!
 ”",963,48.6g,17.6g,16.5g,2.3g,53.6g,82.7g,6.5g,"1                                                                                                                                                                stick of                                                                                                                                                                lemongrass, 1                                                                                                                                                                                                                    shallot, 5                                                                                                                                                                cm                                                                                                                                                                piece of ginger, 3                                                                                                                                                                                                                    fresh red chillies, 6                                                                                                                                                                                                                    lime leaves                                                                                                                                                                , (fresh or dried), 100                                                                                                                                                                g                                                                                                                                                                unsalted peanuts, 1                                                                                                                                                                tablespoon                                                                                                                                                                tomato purée, 2                                                                                                                                                                tablespoons                                                                                                                                                                fish sauce, 1                                                                                                                                                                                                                    lime, 1 x 800                                                                                                                                                                g                                                                                                                                                                whole sea bass                                                                                                                                                                , scaled, gutted, from sustainable sources, 1                                                                                                                                                                large                                                                                                                                                                banana leaf                                                                                                                                                                , optional, 1                                                                                                                                                                tablespoon                                                                                                                                                                low-salt soy sauce, PICKLE, 3                                                                                                                                                                                                                    mixed-colour chillies, 1                                                                                                                                                                pinch of                                                                                                                                                                sugar, 2                                                                                                                                                                tablespoons                                                                                                                                                                white wine vinegar, SALAD, 1                                                                                                                                                                                                                    fresh coconut, 75                                                                                                                                                                g                                                                                                                                                                sugar snap peas, 75                                                                                                                                                                g                                                                                                                                                                mangetout, ¼                                                                                                                                                                of a                                                                                                                                                                 Chinese cabbage, ¼                                                                                                                                                                of a                                                                                                                                                                red cabbage, ¼                                                                                                                                                                of a                                                                                                                                                                 cucumber, 1                                                                                                                                                                                                                    ripe mango, ½                                                                                                                                                                 a bunch of                                                                                                                                                                fresh mint                                                                                                                                                                 , (15g), ½                                                                                                                                                                 a bunch of                                                                                                                                                                fresh coriander                                                                                                                                                                , (15g), ½                                                                                                                                                                 a bunch of                                                                                                                                                                fresh basil                                                                                                                                                                , (15g), 1                                                                                                                                                                                                                    lime, COCONUT RICE, 2                                                                                                                                                                tablespoons                                                                                                                                                                vegetable oil, 1                                                                                                                                                                tablespoon                                                                                                                                                                creamed coconut, 1                                                                                                                                                                                                                    lime, 1                                                                                                                                                                mug of                                                                                                                                                                jasmine rice","Preheat the oven to 220°C/425°F/gas 7., Whack the lemongrass against your work surface and remove the tough outer layer. Peel the shallot and ginger, deseed the chillies, then roughly chop everything with the lemongrass. Add to a large pestle and mortar with a good pinch of sea salt and the lime leaves (discard the stalks) and pound to a paste., Toast the peanuts in a large frying pan over a medium heat for 3 minutes, or until golden, then bash half into the paste. Add the tomato purée and fish sauce, finely grate in the lime zest and squeeze in all the juice, then muddle together., With a sharp knife, score the sea bass skin at 1cm intervals in a criss-cross fashion, then rub all over with the paste, both inside and out., Get your banana leaf (if using), or tear off a piece of baking paper five times as long as the fish and fold it in half to give you double thickness. Place the fish in the middle, then fold over to seal the fish snuggly inside. Place on a large baking tray and roast for 25 minutes, or until the flesh is succulent and comes away easily from the bone., To make the rice, drizzle the vegetable oil into a saucepan over a medium heat. Crumble in the creamed coconut, then squeeze in the lime juice, throwing in the squeezed lime halves. Tip in the rice and fry for 2 minutes, then pour over 1 mug of boiling water and turn down the heat to low. Cover and cook for 12 minutes, then remove from the heat and allow to steam for a further 3 minutes., For the chilli pickle, finely slice the chillies and place in a small bowl with the sugar, vinegar and a pinch of salt, then mix together and leave aside., Now make the salad. Crack open the coconut and finely grate 50g of flesh into a serving bowl. Halve the sugar snaps and mangetout, finely shred both cabbages and cucumber, then peel and finely slice the mango and add it all to the bowl. Pick in most of the herb leaves, squeeze over the lime juice and toss together., Pop the fish on a serving platter. Roughly crush the remaining peanuts in a pestle and mortar, then scatter over the salad and the fish. Drizzle the fish with the soy sauce and scatter over the remaining salad herbs., Take the fish, chilli pickle, rice and salad to the table and let everyone help themselves."
