Recipe title,Subheading,Image (link),Recipe-detail serves,Recipe-detail time,Recipe-detail,Calories,Fat,Saturates,Sugars,Salt,Protein,Carbs,Fibre,Ingred-list,RecipeSteps
Thai Sea Bass | Fish Recipes | Jamie Oliver Recipes,"Full of fragrant, light and fresh flavours","https://img.jamieoliver.com/jamieoliver/recipe-database/oldImages/large/547_1_1438963293.jpg?tr=w-800,h-1066","['Serves', '4']",In40 minutes,"“This steamed sea bass is a joy – those delicate Thai flavours, the fluffy fish… beautiful ”",649,13.1g,6.2g,6.3g,2.55g,43.8g,87.3g,1.3g,"For the Thai paste, 2                                                                                                                                                                large bunches                                                                                                                                                                fresh coriander                                                                                                                                                                , leaves picked and stalks reserved, 2                                                                                                                                                                thumb-sized pieces                                                                                                                                                                fresh ginger                                                                                                                                                                , peeled, 3                                                                                                                                                                cloves                                                                                                                                                                garlic                                                                                                                                                                , peeled, 2                                                                                                                                                                                                                    fresh red chillies                                                                                                                                                                , halved and deseeded, 2                                                                                                                                                                teaspoons                                                                                                                                                                sesame oil, 6                                                                                                                                                                tablespoons                                                                                                                                                                soy sauce, 2                                                                                                                                                                                                                    limes                                                                                                                                                                , juice and zest of, 400                                                                                                                                                                ml                                                                                                                                                                light coconut milk, For the sea bass and rice, 400                                                                                                                                                                g                                                                                                                                                                basmati rice, sea salt, freshly ground black pepper, 4 x 170                                                                                                                                                                g                                                                                                                                                                sea bass fillets                                                                                                                                                                , from sustainable sources, ask your fishmonger, pinboned and skin scored, 1                                                                                                                                                                handful                                                                                                                                                                sugar snap peas or mangetouts, 1                                                                                                                                                                bunch                                                                                                                                                                spring onions                                                                                                                                                                , outer leaves discarded, trimmed and finely sliced, 1-2                                                                                                                                                                                                                    fresh red chillies                                                                                                                                                                , deseeded and finely sliced, 1                                                                                                                                                                                                                    lime                                                                                                                                                                , quartered","Preheat the oven to 200ºC/400ºF/gas 6. In a food processor or liquidizer, whiz up the coriander stalks, half of the coriander leaves, the ginger, garlic, halved chillies, sesame oil, soy sauce, lime juice and zest and the coconut milk. This will give you a lovely fragrant Thai-style paste., Cook your rice in salted, boiling water until it’s just undercooked, then drain it in a colander. Scoop it into a high-sided roasting tray. Pour your Thai paste over the rice and mix it in well, then shake it out flat. Lay the sea bass fillets on top, scatter over the sugar snap peas or mangetouts, then cover the dish tightly with tinfoil and put it in the preheated oven for around 15 minutes. Remove the foil and sprinkle over the spring onions, the sliced chilli and the other half of the coriander leaves. Divide between your plates with a wedge of lime."
Asian Sea Bass Recipe | Fish Recipes | Jamie Oliver Recipes,"With a lime, ginger and lemongrass marinade","https://img.jamieoliver.com/jamieoliver/recipe-database/oldImages/large/544_1_1439310616.jpg?tr=w-800,h-1066","['Serves', '2']",marinating time,“This is one of the most heavenly sea bass dishes ever! You'll love the delicate flavour combo ”,386,21.5g,3.6g,2.4g,1.14g,43.7g,4.5g,0.4g,"6                                                                                                                                                                                                                    lime leaves, 1-2                                                                                                                                                                sticks                                                                                                                                                                lemon grass                                                                                                                                                                , chopped, 1                                                                                                                                                                clove                                                                                                                                                                garlic                                                                                                                                                                , finely sliced, 1-2                                                                                                                                                                                                                    red chillies                                                                                                                                                                , to taste, seeded and chopped, 1                                                                                                                                                                small tablespoon                                                                                                                                                                freshly grated ginger, 1                                                                                                                                                                handful                                                                                                                                                                coriander                                                                                                                                                                , leaves picked and stalks reserved, plus extra to serve, 1                                                                                                                                                                tablespoon                                                                                                                                                                Kikkoman low-salt soy sauce, 1                                                                                                                                                                                                                    lime                                                                                                                                                                , zested and halved, 2                                                                                                                                                                tablespoons                                                                                                                                                                olive oil, 2                                                                                                                                                                thick                                                                                                                                                                sea bass fillets                                                                                                                                                                , from sustainable sources, ask your fishmonger, about 200g each, 1                                                                                                                                                                                                                    free-range egg white, 1                                                                                                                                                                small wineglass                                                                                                                                                                sake","Preheat your oven to 220ºC/425ºF/gas 7., Take the top shelf out of the oven and place a baking tray on the middle shelf., Tear off a metre of kitchen foil. Fold it in half so it’s double thickness, then fold it in half again. You should end up with what looks like a big, foil birthday card. Make two of these then lay them opened and flat on your table. Each foil wrap will hold one piece of fish – you can do a big one for four or a slightly smaller version for two., In a pestle and mortar, bash your lime leaves until they break down and all the flavour comes out. Then add the lemon grass and do the same again. Do this for a couple of minutes... it’s worth every second. Then add the garlic, chilli, grated ginger and all of the coriander stalks. Once this is all smashed to a pulp, add the soy sauce, the lime zest and juice and the olive old. Mix well, then taste and correct the seasoning with extra soy sauce as you see fit., Lightly score the sea bass on the skin side with a sharp knife and then rub them with the lime-ginger-lemon grass mix. Allow to marinate for an hour, if you have time, or you can cook it all straight away., Lightly brush the foil edges with a little beaten egg white – this helps to seal the parcel when you fold it up and keeps all the flavoured steam inside to cook the fish., Put the portions of sea bass, skin-side up on one side of each envelope. Divide the marinade and all the juice between the two packages and tuck some coriander into the slits of each piece of fish. Fold over the foil, then fold up two sides of the envelopes securely. Just before you seal the final side of the foil bags, divide the sake between the two envelopes, taking care so that it doesn’t dribble out. Pucker and bend the folded sides up so that the juices can’t cook out. Don’t fold the foil right up to the edge of the fish – leave about 2 inches (5 cm) of space all round the fillets to let the steam circulate., I know all this sounds like a bit of a palaver, but it’s actually dead simple., Place straight on to the hot tray and cook for about 12 minutes in the preheated oven. Once cooked, allow to sit for 2–3 minutes. Serve the bags at the table – just cut them open and carefully lift out the fish. You can spoon the juices over it (but don’t eat the bits from the marinade as they’re really only there for flavour)., I like to serve this with a bowl of coriander-flavoured rice or noodles, cooked simply. You’re going to love it."
Mixed Fish | Fish Recipes | Jamie Oliver Recipes,A brilliant dish with any kind of fish,"https://img.jamieoliver.com/jamieoliver/recipe-database/oldImages/large/373_1_1436870113.jpg?tr=w-800,h-1066","['Serves', '2']",In15 minutes,"“This simple, flavoursome fish is great on the barbecue too or, even healthier, steamed. ”",365,18.4g,2.2g,3.0g,1.62g,43.7g,6.5g,2.5g,"olive oil, 2                                                                                                                                                                small                                                                                                                                                                red mullet or snapper fillets                                                                                                                                                                , scaled, pin-boned, from sustainable sources, 1                                                                                                                                                                                                                    royal bream fillet or sea bass fillet                                                                                                                                                                , scaled, pin-boned, cut in half, from sustainable sources, 2                                                                                                                                                                small                                                                                                                                                                squid                                                                                                                                                                , gutted, cleaned, tentacles trimmed and reserved, from sustainable sources, 2-4                                                                                                                                                                                                                    freshly shelled scallops                                                                                                                                                                , cleaned and scored in a criss-cross fashion, from sustainable sources, 10                                                                                                                                                                medium                                                                                                                                                                asparagus spears                                                                                                                                                                , woody ends removed, 1                                                                                                                                                                small handful                                                                                                                                                                thyme tips, 1                                                                                                                                                                                                                    fresh red chilli                                                                                                                                                                , deseeded and chopped, extra virgin olive oil, 1                                                                                                                                                                                                                    lemon, 1                                                                                                                                                                small handful                                                                                                                                                                fennel tops","Get a really large frying pan, or two smaller ones, on the heat and add a lug of olive oil. Score the skin of your fish fillets all over, about 1cm deep, and season., Put the fish fillets into the pan, skin side down, with the squid tentacles. Add the scallops. Run your knife down one side of each squid to open them out, then quickly and lightly score the inside in a criss-cross fashion. Lay them in the pan, scored side down., Add the asparagus and gently shake the pan. Cook for a few minutes, then turn everything over and cook on the other side. Sprinkle over the thyme tips., You’re the one in control of the pan, so if something looks cooked, take it out and keep it warm. Don’t watch things burn! When the fish has crispy skin, the scallops are golden brown with caramelized edges and the squid has curled up and is nicely chargrilled, remove the pan from the heat., Put the squid on a chopping board and roughly slice it into pieces at an angle, then return to the pan. Lay the fish fillets on each plate. Toss the asparagus, scallops and squid with half the chilli, a good drizzle of good-quality extra virgin olive oil and the lemon juice. Lightly season and mix together., Divide on top of the plated fish. Sprinkle with the rest of the chopped chilli and the fennel tops, and drizzle with extra virgin olive oil."
