Recipe title,Subheading,Image (link),Recipe-detail serves,Recipe-detail time,Recipe-detail,Calories,Fat,Saturates,Sugars,Salt,Protein,Carbs,Fibre,Ingred-list,RecipeSteps
Toad in the hole | Jamie Oliver leftovers recipes,Yorkshire pudding filled with leftovers & dirty gravy,"https://img.jamieoliver.com/jamieoliver/recipe-database/90246165.jpg?tr=w-800,h-1066","['Serves', '4']",In45 minutes,"“What’s not to love about this bad boy – all the best bits of the Christmas Day meal, wrapped up in crispy fluffy Yorkshire pudding like an extra present! You can pretty much use whatever leftovers you have in this epic creation – enjoy. ”",965,58.7g,13.6g,10.2g,1.9g,33.7g,80.1g,6.5g,"2                                                                                                                                                                rashers of                                                                                                                                                                higher-welfare smoked streaky bacon, 4                                                                                                                                                                                                                    higher-welfare chipolata sausages, 4                                                                                                                                                                                                                    fresh sage leaves, 4                                                                                                                                                                                                                    leftover roast potatoes, 4                                                                                                                                                                tablespoons                                                                                                                                                                leftover stuffing, 8                                                                                                                                                                                                                    leftover Brussels sprouts, 2                                                                                                                                                                sprigs of                                                                                                                                                                fresh rosemary, 100                                                                                                                                                                ml                                                                                                                                                                sunflower oil, YORKSHIRE BATTER, 3                                                                                                                                                                large                                                                                                                                                                free-range eggs, 100                                                                                                                                                                g                                                                                                                                                                plain flour, 250                                                                                                                                                                ml                                                                                                                                                                semi-skimmed milk, DIRTY GRAVY, 1                                                                                                                                                                                                                    leek, 25                                                                                                                                                                g                                                                                                                                                                unsalted butter                                                                                                                                                                , or higher-welfare turkey dripping, 80                                                                                                                                                                g                                                                                                                                                                leftover cooked higher-welfare turkey meat, 1                                                                                                                                                                heaped tablespoon                                                                                                                                                                plain flour, 1                                                                                                                                                                tablespoon                                                                                                                                                                cranberry sauce, 700                                                                                                                                                                ml                                                                                                                                                                free-range chicken stock","So, guys, to make this incredible treat obviously requires you to have leftovers, which will differ for all of us. I’ve given you the recipe for the pigs in blankets and the batter, and everything else is based on what you’ve got – just don’t overload it., Start by moving your oven shelves around so you have plenty of space in the middle of the oven for your Yorkshire to grow., Preheat the oven to 220ºC/425ºF/gas 7., For the Yorkshire, beat the eggs into the flour with a pinch of sea salt, then gradually whisk in the milk to give you a smooth batter, and pour into a jug., Wrap half a rasher of bacon around each sausage, poking in a sage leaf, too. Pop on to a baking tray with the potatoes (roughly chop, if you like), balls or pinches of stuffing, and the sprouts., Pick over the rosemary leaves and place in the top of the oven for 10 minutes., Pour the sunflower oil into a baking dish (25cm x 30cm) and place in the oven on the shelf underneath, to preheat the oil properly., Meanwhile, for the gravy, wash, trim and finely slice the leek, then put it into a frying pan on a medium heat with the butter or dripping. Cook for 10 minutes, or until soft, stirring occasionally., Shred in the turkey meat and stir in the flour and cranberry sauce, followed by the stock., Simmer for 15 to 20 minutes, or until thick, then taste and season to perfection., For the next bit, you need to be cool, calm and safe, as you’re working with hot oil, and you want to retain the heat from the oven., Have your jug of batter ready and two oven gloves or tea towels. Keep the tray of oil in the oven and carefully pull the shelf out a little.Holding it steady, pour in the batter, then gently transfer everything from the tray above into the centre., Push the shelf back in and keep the door shut for 20 to 25 minutes, or until the Yorkshire is puffed up and golden., Serve the Christmas toad in the hole with the dirty gravy, any extra cranberry sauce, and with a nice fresh slaw on the side."
Cranberry Christmas turkey | Jamie Oliver Christmas recipes,Bacon & thyme,"https://img.jamieoliver.com/jamieoliver/recipe-database/83911439.jpg?tr=w-800,h-1066","['of', 'leftovers']",plus resting),"“It’s turkey time and my epic cranberry-basted bird is no stress – quick to prep and turbo-charged with flavour. Get ahead by prepping the bird ready for roasting on Christmas Eve, then simply calculate your cooking times and let the oven do the hard work.  Happy days. ”",252,14.9g,6.6g,0.2g,0.4g,29.3g,0.4g,0.3g,"1 x 7                                                                                                                                                                kg                                                                                                                                                                 free-range turkey                                                                                                                                                                , with giblets (I use a Paul Kelly bird), 100                                                                                                                                                                g                                                                                                                                                                dried cranberries, 1                                                                                                                                                                big bunch of                                                                                                                                                                fresh thyme                                                                                                                                                                 , (60g), 250                                                                                                                                                                g                                                                                                                                                                unsalted butter                                                                                                                                                                , (at room temperature), 12                                                                                                                                                                rashers of                                                                                                                                                                higher-welfare smoked streaky bacon",
Turkey breast with sausage & apricot stuffing | Turkey recipes | Jamie Magazine,Covered with crisped-up streaky bacon,"https://img.jamieoliver.com/jamieoliver/recipe-database/63227647.jpg?tr=w-800,h-1066","['with', 'leftovers']",plus resting,"“A great alternative to cooking a whole turkey at Christmas, this turkey breast is packed with flavourful stuffing to keep it juicy and delicious. ”",174,6.7g,2.2g,2.8g,0.4g,24g,4.7g,0.7g,"1                                                                                                                                                                medium                                                                                                                                                                onion, 1                                                                                                                                                                large clove of                                                                                                                                                                garlic, olive oil, 250                                                                                                                                                                g                                                                                                                                                                higher-welfare Cumberland sausages, ½                                                                                                                                                                a bunch of                                                                                                                                                                fresh sage, 100                                                                                                                                                                g                                                                                                                                                                dried apricots, 50                                                                                                                                                                g                                                                                                                                                                fresh breadcrumbs, 2                                                                                                                                                                kg                                                                                                                                                                higher-welfare turkey breast                                                                                                                                                                , skin on, butterflied, 10                                                                                                                                                                rashers of                                                                                                                                                                higher-welfare streaky bacon","Preheat the oven to 200ºC/400ºF/gas 6., Peel and finely chop the onion and garlic. Drizzle a little oil into a frying pan over a medium heat and sauté the onion, stirring occasionally, until completely translucent. Stir in the garlic and cook until golden, then remove from the heat and allow to cool., Squeeze the sausagemeat from the skins into a large bowl. Roughly chop the sage leaves and apricots, and stir into the sausagemeat along with the breadcrumbs and cooled onion mixture. Use your hands to bring it all together., Lay the turkey breast on a clean chopping board, skin-side down, and evenly spread the stuffing over the top. With the longest side of the breast closest to you, tightly roll it up, then place seam-side down on the board. Drape the streaky bacon widthways along the length of the turkey., Tie up the turkey breast with 5 or 6 pieces of kitchen string, about 5cm apart, knotting them tightly to secure the roll. Drizzle over a little oil and season with sea salt and black pepper., Place the turkey breast in a roasting tin, cover with tin foil and roast for 1 hour and 20 minutes (or 40 minutes per kilo), removing the foil for the last 20 minutes to allow the bacon to crisp up. Pierce the centre of the turkey and check that the juices run clear., Transfer the turkey to a board, cover with foil and a clean tea towel and allow to rest for 20 to 30 minutes before serving."
Turkey risotto | Turkey recipes | Jamie Oliver recipes,"Sweet leeks, Parmesan, Prosecco, crispy turkey skin & gravy","https://img.jamieoliver.com/jamieoliver/recipe-database/2HKDAhve4dJ96skYay_75A.jpg?tr=w-800,h-1066","['a', 'starter']",In35 minutes,"“Ladies and gentlemen, let me introduce you to one of the very nicest risottos on planet earth – it’s oozy, delicate and super-comforting, with wafer-thin crispy turkey skin, and a well in the middle for your steaming leftover gravy. Amen. ”",815,23.5g,9.9g,8.5g,0.8g,50.1g,94.6g,3.1g,"leftover cooked higher-welfare turkey skin, 8                                                                                                                                                                sprigs                                                                                                                                                                of fresh thyme, 1                                                                                                                                                                                                                    onion, 1                                                                                                                                                                                                                    leek, 2                                                                                                                                                                sticks                                                                                                                                                                of celery, olive oil, 1.4                                                                                                                                                                litres                                                                                                                                                                organic chicken or veg stock, 300                                                                                                                                                                g                                                                                                                                                                Arborio risotto rice, 125                                                                                                                                                                ml                                                                                                                                                                Prosecco, 300                                                                                                                                                                g                                                                                                                                                                leftover cooked white higher-welfare turkey meat, 100                                                                                                                                                                ml                                                                                                                                                                leftover higher-welfare turkey gravy, 50                                                                                                                                                                g                                                                                                                                                                Parmesan cheese, 25                                                                                                                                                                g                                                                                                                                                                unsalted butter, 1                                                                                                                                                                tablespoon                                                                                                                                                                mascarpone cheese, new season's extra virgin olive oil                                                                                                                                                                , optional","I like to place any leftover turkey skin from the bottom of the carcass into a cold casserole pan, then put it on a medium heat so the fat naturally renders out and it becomes super-crisp, like crackling, turning halfway., When it’s golden, strip in the thyme leaves to crisp up for just 10 seconds, then scoop the crispy skin and thyme on to a plate, keeping the pan of flavoursome fat to one side., Peel the onion, wash the leek and trim with the celery, then finely chop it all., Return the pan of fat to a medium heat, then add the veg and fry for 10 minutes, or until soft but not coloured, stirring occasionally, and adding a splash of oil, if needed., Pour the stock into a separate pan and bring to a simmer on a low heat., Stir the rice into the veg for a couple of minutes, then pour in the Prosecco. Let it cook away, then start adding the stock, a ladleful at a time, letting each one cook away before adding more. Keep a close eye on it and stir constantly for 17 minutes, or until the rice is cooked but still retains its shape., Meanwhile, finely chop the turkey meat, stirring it into the pan halfway through the 17 minutes. Reheat your gravy, then sieve it into a pre-warmed jug ready to pour at the table., When the risotto is done, add enough extra stock to make it oozy, then remove from the heat., Finely grate over most of the Parmesan and beat it in with the butter and mascarpone, then taste and season to perfection. Put the lid on and take to the table., Divide between your hot plates, make a well in the middle of each portion and flamboyantly pour in the hot gravy, then crack and crumble the crispy skin and thyme over the top., Finish with a tiny extra grating of Parmesan, and a thimble of new season’s extra virgin olive oil, if you’ve got it."
