Recipe title,Subheading,Image (link),Recipe-detail serves,Recipe-detail time,Recipe-detail,Calories,Fat,Saturates,Sugars,Salt,Protein,Carbs,Fibre,Ingred-list,RecipeSteps
Turkey stew | Turkey recipes | Jamie Oliver recipes,Sweet leek & smoky bacon biscuit dumplings,"https://img.jamieoliver.com/jamieoliver/recipe-database/51137632.jpg?tr=w-800,h-1066","['Serves', '6']",plus cooling,"“This is a super-easy, old-school dish that uses leftover turkey or chicken in a brilliant way. As a kid I made it with dumplings, but when I was in the USA they would top stews with these lovely biscuits, so this is my hybrid of the two. ”",487,19.7g,6.1g,10.7g,1.4g,38g,41.3g,4g,"DUMPLINGS, 2                                                                                                                                                                rashers of                                                                                                                                                                higher-welfare smoked streaky bacon, 2                                                                                                                                                                small                                                                                                                                                                leeks, olive oil, 125                                                                                                                                                                g                                                                                                                                                                self-raising flour, 25                                                                                                                                                                g                                                                                                                                                                maize flour                                                                                                                                                                , or polenta, 30                                                                                                                                                                g                                                                                                                                                                unsalted butter (cold), 125                                                                                                                                                                ml                                                                                                                                                                buttermilk, 1                                                                                                                                                                large                                                                                                                                                                free-range egg, STEW, 3                                                                                                                                                                                                                    onions, 3                                                                                                                                                                sticks of                                                                                                                                                                celery, 2                                                                                                                                                                sprigs of                                                                                                                                                                fresh rosemary, 3                                                                                                                                                                sprigs of                                                                                                                                                                fresh thyme, 3                                                                                                                                                                                                                    fresh bay leaves, 2                                                                                                                                                                teaspoons                                                                                                                                                                English mustard, 2                                                                                                                                                                tablespoons                                                                                                                                                                plain flour, 1.5                                                                                                                                                                litres                                                                                                                                                                organic veg stock, 150                                                                                                                                                                g                                                                                                                                                                leftover stuffing, 500                                                                                                                                                                g                                                                                                                                                                leftover cooked free-range turkey or chicken meat","To start the dumplings, roughly chop the bacon and place in a large frying pan on a medium-low heat to crisp up while you wash, trim and finely slice the leeks., Stir them into the pan with 1 tablespoon of oil, then cook for 15 minutes, or until soft and sweet, stirring occasionally. Remove from the heat and leave to cool., Meanwhile, for the stew, peel the onions, trim the celery, then roughly chop both and place in a large, wide casserole pan on a medium heat with 2 tablespoons of oil (or even better, use turkey dripping to intensify the flavours)., Add the herb sprigs and bay, and cook for 15 minutes, or until soft but not coloured, stirring regularly. Stir in the mustard and flour for 2 minutes, then gradually stir in the stock to make a nice thick sauce., Crumble in the leftover stuffing and turn the heat off. Scoop out and discard the herb sprigs and bay leaves, then shred the turkey or chicken meat, stir it into your stew, taste, and season to perfection., Preheat the oven to 200°C/400°F/gas 6., Place the flours in a large bowl. Dice and add the butter, then use your thumbs and forefingers to rub the butter into the flour until it resembles breadcrumbs., Make a well in the middle, pour in the buttermilk, then gradually mix into the crumbs, bringing them in from the outside. Stir in the cooled leeks and bacon until just combined, but don’t overwork it – we want the dough as light as possible., Gently roll it out on a clean flour-dusted surface until 2cm thick, then use a 5cm fluted cutter to stamp out as many round dumplings as you can, re-rolling and using up any offcuts – you should get at least 12 from this amount., Brush the dumplings with beaten egg, then sit them on top of the stew., Bake for 25 to 30 minutes, or until the dumplings are risen and golden and the stew is blipping and bubbling away nicely. Delicious with simple steamed greens."
Turkey Kofte | Turkey Recipes | Jamie Oliver,,"https://img.jamieoliver.com/jamieoliver/recipe-database/4Ne8FYz1KaTBkhqatYic4d.jpg?tr=w-800,h-1066","['Serves', '4']",plus chilling,,544,14.6g,4.6g,19.3g,-g,50.4g,54g,,"TURKEY KOFTE, 1                                                                                                                                                                large                                                                                                                                                                courgette, 2                                                                                                                                                                                                                    spring onions, 1                                                                                                                                                                                                                    fresh red chilli, 50                                                                                                                                                                g                                                                                                                                                                shelled pistachios, 3                                                                                                                                                                sprigs of                                                                                                                                                                fresh coriander, 3                                                                                                                                                                sprigs of                                                                                                                                                                fresh flat-leaf parsley, 3                                                                                                                                                                sprigs of                                                                                                                                                                fresh mint, ¼                                                                                                                                                                teaspoon                                                                                                                                                                cumin seeds, 1                                                                                                                                                                large                                                                                                                                                                free-range egg, 500                                                                                                                                                                g                                                                                                                                                                free-range minced turkey, ½                                                                                                                                                                teaspoon                                                                                                                                                                dried oregano, CHILLI SAUCE, 4                                                                                                                                                                                                                    ripe tomatoes, 2                                                                                                                                                                small                                                                                                                                                                onions, 4                                                                                                                                                                cloves of                                                                                                                                                                garlic, 4                                                                                                                                                                                                                    fresh red chillies, olive oil, 1                                                                                                                                                                tablespoon                                                                                                                                                                brown sugar, 2                                                                                                                                                                tablespoons                                                                                                                                                                tomato purée, 1                                                                                                                                                                tablespoon                                                                                                                                                                red wine vinegar, TAHINI YOGHURT, 250                                                                                                                                                                g                                                                                                                                                                Greek yoghurt, 1                                                                                                                                                                tablespoon                                                                                                                                                                tahini, 1                                                                                                                                                                squeeze of                                                                                                                                                                lemon juice, TURKISH PILAV, 1                                                                                                                                                                                                                    onion, 2                                                                                                                                                                                                                    cloves of garlic, 200                                                                                                                                                                g                                                                                                                                                                bulgur wheat, 400                                                                                                                                                                ml                                                                                                                                                                hot organic chicken stock, 1                                                                                                                                                                knob of                                                                                                                                                                unsalted butter, 80                                                                                                                                                                g                                                                                                                                                                broken rice vermicelli, 100                                                                                                                                                                g                                                                                                                                                                tinned chickpeas (drained weight)","Finely grate the courgette, trim and finely chop the spring onions and green chilli, then chop the pistachios. Pick and finely chop all the fresh herbs., Toast the cumin seeds in a dry pan until smelling fantastic. Meanwhile, lightly beat the egg., Mix all the kofte ingredients together in a large bowl, keeping some pistachios back to garnish, then season well., With wet hands, form 16 kofte, each the size and shape of a small egg. Leave in the fridge to firm up for at least 30 minutes, then thread onto metal skewers, two kofte on each., Cook the kofte under a grill or over a flame charcoal grill, on high for 12 minutes, until juicy, golden brown and cooked through, turning regularly., Preheat the oven to 180ºC/gas 4., To make the chilli sauce, halve the tomatoes and onions (there's no need to peel), and bash the unpeeled garlic cloves., Place the red chillies, tomatoes, onions and garlic on a baking tray. Drizzle with oil and season, then roast for 25 minutes or until soft and slightly blackened., Allow to cool slightly, then carefully remove and discard the stalks from the chillies, the cores from the tomatoes and the skins from the onions and garlic., Add to a food processor, along with the sugar, tomato purée and vinegar. Blitz until smooth and add a lug of oil to make it glossy. Pulse again, then season., For the tahini yoghurt, mix all the ingredients in a bowl and season with a pinch each of sea salt and black pepper., To make the pilav, peel and finely chop the onion and garlic. Add a lug of oil to a non-stick pan over a medium-low heat, then sweat the onion and garlic for 10 minutes. Add the bulgur and stir to coat., Pour in the stock, bring it to the boil, then turn down the heat to very low. Cover with a lid and steam the bulgur for 8 minutes., Meanwhile, in a separate pan, melt the butter and cook the vermicelli until the butter turns golden brown., After 8 minutes, add it to the bulgur along with the chickpeas – don’t stir at any point, just replace the cloth and lid and let it steam for another 8 minutes., Turn off the heat and let it stand for 5 minutes – you should end up with a beautifully light and fluffy pilav., Serve the kofte accompanied by the pilav, chilli sauce and tahini yoghurt, then finish scattered with the reserved pistachios."
Festive Turkey Croque-Monsieur | Turkey Recipes | Jamie Oliver,,"https://img.jamieoliver.com/jamieoliver/recipe-database/46259666.jpg?tr=w-800,h-1066","['Serves', '4']",In20 minutes,"“This recipe is from Bruno Loubet, chef at his eponymous restaurant, Bistro Bruno Loubet, in London's Clerkenwell.  ”",744,34.2g,18.7g,17.2g,,53.8g,54.3g,,"40                                                                                                                                                                g                                                                                                                                                                unsalted butter, 40                                                                                                                                                                g                                                                                                                                                                plain flour, 400                                                                                                                                                                ml                                                                                                                                                                milk, 2                                                                                                                                                                tablespoons                                                                                                                                                                Dijon mustard, 100                                                                                                                                                                g                                                                                                                                                                Stilton, 8                                                                                                                                                                slices of                                                                                                                                                                white bread, cranberry sauce, 100                                                                                                                                                                g                                                                                                                                                                Gruyère cheese, 400                                                                                                                                                                g                                                                                                                                                                leftover free-range cooked turkey","Preheat the oven to 220ºC/gas 7., In a saucepan on a low heat, melt the butter until foamy, but not coloured, then stir in the flour. Cook for 3 minutes. Pour in the cold milk and whisk well to avoid lumps forming., Raise the heat and leave to simmer for a few minutes. Remove from the heat, stir in the mustard and crumble in the Stilton, and check the seasoning., Line the bread on the work surface and spread 4 slices with cranberry sauce, then Stilton sauce and grate over half the Gruyère., Top with turkey and sandwich with the remaining bread. Press lightly, then spread the 4 tops with the remaining sauce and finish by grating over the remaining Gruyère., Bake until the cheese melts and the sandwiches turn golden brown. Serve with a green salad."
