Recipe title,Subheading,Image (link),Recipe-detail serves,Recipe-detail time,Recipe-detail,Calories,Fat,Saturates,Sugars,Salt,Protein,Carbs,Fibre,Ingred-list,RecipeSteps
Cajun rice and barbecue turkey burrito,"Feta, yoghurt & hot chilli sauce","https://img.jamieoliver.com/jamieoliver/recipe-database/oldImages/large/978_6_1442240183.jpg?tr=w-800,h-1066","['Serves', '4']",In25 minutes,"“This is a quick, easy and super delicious way to use up any leftover turkey – with the holy Cajun trinity of onion, pepper and celery in the rice and pops of caramelised meat, all wrapped up in a soft tortilla – trust me, it’s to die for.  ”",512,13.8g,3.5g,8.3g,2.00g,33.6g,65.5g,2.9g,"1                                                                                                                                                                                                                    red pepper, 2                                                                                                                                                                sticks of                                                                                                                                                                 celery, 1                                                                                                                                                                                                                    fresh red chilli, 6                                                                                                                                                                                                                    spring onions, 2                                                                                                                                                                cloves of                                                                                                                                                                garlic, 1                                                                                                                                                                bunch of                                                                                                                                                                fresh coriander, olive oil, sea salt, freshly ground black pepper, 1 x 250                                                                                                                                                                g pack of                                                                                                                                                                Uncle Ben’s pre-cooked wholegrain rice, 1                                                                                                                                                                                                                    lemon                                                                                                                                                                , zest and juice of, 250                                                                                                                                                                g                                                                                                                                                                leftover cooked turkey, 3                                                                                                                                                                heaped tablespoons                                                                                                                                                                quality barbecue sauce, 4                                                                                                                                                                large                                                                                                                                                                flour tortillas, 30                                                                                                                                                                g                                                                                                                                                                feta cheese, low-fat natural yoghurt                                                                                                                                                                , to serve, Cholula hot chilli sauce                                                                                                                                                                , to serve","For this recipe, you will need 250g leftover cooked turkey, Deseed the pepper and trim the celery, then roughly chop into 1cm chunks. Deseed and finely slice the chilli, then trim and finely slice the spring onions and peel and finely slice the garlic., Pick the coriander leaves and set aside for later, then finely slice the stalks. Put all the chopped veg and herb stalks into a large non-stick frying pan over a high heat with a couple of lugs of olive oil and a pinch of salt and pepper. Fry for around 5 minutes, or until soft, stirring regularly., Add the rice, lemon zest and juice and cook for a further 5 minutes, or until golden and warmed through., Meanwhile, toss the turkey in the barbecue sauce, then add to a medium frying pan over a medium-high heat and cook for 5 to 10 minutes, or until crispy and slightly caramelised., Warm the tortillas in a dry frying pan, then divide and pile equal amounts of the Cajun rice and turkey onto one side of each tortilla. Scatter over the reserved coriander leaves and crumble the feta on top., Roll them up, tucking in one side as you go, so you end up with four open-ended burritos. Serve with a dollop of yoghurt and a drizzle of chilli sauce on the side."
Christmas butter | Jamie Oliver recipes,"Cranberries, clementines & fresh herbs","https://img.jamieoliver.com/jamieoliver/recipe-database/29SaW1D3qqL8y-gtuaMATK.jpg?tr=w-800,h-1066","['Serves', '10']",In25 minutes,"“This butter is a job for Christmas Eve. It won’t take long and will guarantee you happiness the day after. A really beautiful turkey like Mr Kelly’s doesn't need anything more than olive oil and salt and pepper, they’re that good. While the purist in me says leave it alone, the chef in me is curious and wants to experiment. I think the bird, and the occasion, deserve a bit of extra love so if you can add a bit of an edge with something that complements and enhances its natural flavours, why not try it?

An experiment of mine I’m happy to say really worked out was this flavoured butter. It looks beautiful, gives a delicate sweetness and holds the skin away from the meat so it gets extra crispy as it cooks. Another bonus is that the butter’s journey out of the bird will give you a self-basting bird. Brilliant. ”",214,20.7g,13.1g,5.1g,,0.2g,6.2g,,"1 x 250                                                                                                                                                                g                                                                                                                                                                pack of butter, 75                                                                                                                                                                g                                                                                                                                                                dried cranberries, a few                                                                                                                                                                sprigs of                                                                                                                                                                fresh thyme, 4                                                                                                                                                                sprigs of                                                                                                                                                                fresh rosemary, a few                                                                                                                                                                sprigs of                                                                                                                                                                fresh sage, 1                                                                                                                                                                                                                    clementine","Put your butter into a bowl. Really finely chop the cranberries and add to the bowl., Pick the thyme, rosemary and sage leaves, then chop, sweep and run your knife through the herb leaves until really finely chopped. Add to the butter with a pinch of sea salt and black pepper., Grate in the zest of your clementine and mix so the butter softens and everything is combined. Divide the butter roughly in half., Get your turkey and use a spoon to work your way between the skin and the meat. Start at the side of the cavity just above the leg and work gently up toward the breastbone and towards the back so you create a large cavity., Pick up half of your butter and push it into the cavity you’ve created. Use your hands to push it through the skin right to the back so it coats the breast meat as evenly as possible. Do the same on the other side, then rub any leftover butter all over the outside of the bird to use it up., If you've got any herb stalks left over, put them in the cavity of the turkey for added flavour as it cooks., Cover the turkey in clingfilm and put in the fridge until you’re ready to cook it the next day."
Turkey Wellington | Turkey Recipes | Jamie Oliver,,"https://img.jamieoliver.com/jamieoliver/recipe-database/oldImages/large/837_1_1439210788.jpg?tr=w-800,h-1066","['Serves', '10']",refrigeration time,,787,29g,16.6g,38g,,15.3g,66.3g,,"1.6                                                                                                                                                                kg                                                                                                                                                                turkey breast                                                                                                                                                                , skin off, preferably higher welfare, sea salt and freshly ground black pepper, olive oil, 1                                                                                                                                                                large bunch                                                                                                                                                                fresh thyme                                                                                                                                                                , leaves picked, 1 x 340                                                                                                                                                                g jar                                                                                                                                                                cranberry jam, 25                                                                                                                                                                g                                                                                                                                                                dried porcini mushrooms, 6                                                                                                                                                                                                                    rashers quality smoked streaky bacon                                                                                                                                                                , thinly sliced, 3                                                                                                                                                                sprigs                                                                                                                                                                fresh rosemary, 600                                                                                                                                                                g                                                                                                                                                                mixed mushrooms                                                                                                                                                                , chopped, 1                                                                                                                                                                                                                    turkey leg, 1                                                                                                                                                                                                                    carrot                                                                                                                                                                , roughly chopped, 1                                                                                                                                                                                                                    leek                                                                                                                                                                , trimmed and roughly chopped, 1                                                                                                                                                                                                                    onion                                                                                                                                                                , peeled and roughly chopped, 2                                                                                                                                                                heaped tablespoons                                                                                                                                                                plain flour                                                                                                                                                                , plus extra for dusting, 1                                                                                                                                                                tablespoon                                                                                                                                                                 balsamic vinegar, 1                                                                                                                                                                knob                                                                                                                                                                unsalted butter, 2 x 500                                                                                                                                                                g packets                                                                                                                                                                all butter puff pastry                                                                                                                                                                , chilled, 1                                                                                                                                                                large                                                                                                                                                                free-range egg                                                                                                                                                                , beaten","Dad and I had a really interesting conversation about smaller families not wanting whole turkeys for their dinner. So we had a scout around the supermarkets and developed a really delicious and impressive recipe for this. It’s dramatic and stretches the meat a fairly long way. The case of pastry and minced mushrooms keeps the breast moist and delicious and is a little forgiving so the meat holds its juices. You could assemble it a day before and just leave it in the fridge ready to over deliver on Christmas day., Preheat the oven to 180°C/350°F/gas 4. Place the turkey breast upside-down on a board. Gently slice into the natural join of the breast muscle to open it out and make a sort of pocket. Season well and drizzle with olive oil. Sprinkle over half the thyme leaves, then spread over an even layer of cranberry jam, pushing it into all the nooks and crannies. Fold it back into shape to seal the mixture inside – swiss roll-stylie – and push a few cocktail sticks into the seam to keep it together. Transfer the turkey to a roasting tray, season the outside with the remaining thyme leaves, a good pinch of salt and pepper and a drizzle of olive oil. Rub it all over, cover in tin foil and roast in the hot oven for 60 to 70 minutes, or until just cooked through – using a thermometer, you want it to be 72°C at the thickest point., Meanwhile, soak the porcini in a dish of just-boiled water. After 5 minutes, stir with a fork so any bits of grit sink to the bottom. Add the bacon to a large frying pan with a splash of oil on a medium heat and fry for 5 to 10 minutes, or until beautifully golden and super crispy. Strip in the leaves from 2 rosemary sprigs for the last 30 seconds or so. Remove everything from the pan with a slotted spoon and set aside, leaving the bacon fat behind. Add the fresh mushrooms to the pan with a pinch of salt and pepper. Drain and chop the porcini, saving the water, then stir into the pan. Add a splash of the water, avoiding the grit, then cook for around 10 to 15 minutes, or until the pan starts to sizzle again and the mushrooms are golden, soft and sticky with caramelly edges., To make the gravy, cut the thigh off the turkey leg and slash into it slightly. Throw the leg and thigh into a pot along with the carrot, leek and onion. Stir in the flour, add a good pinch of salt and pepper and 2 litres of boiling water. Add a heaped tablespoon of cranberry jam, the balsamic vinegar and remaining rosemary sprig. Bring back to the boil, then reduce to a simmer for around 2 hours, or until thick. Strain it through a sieve and reheat before serving., When the mushroom pan is dry, add a knob of butter and toss to coat.  Tip the mushrooms into the food processor and whiz until you get a good mixture of smooth and chunky. Leave to cool. Once the turkey breast and stuffing have cooled, you can get on with assembling the wellington., Dust a clean surface with flour, then roll out each packet of puff pastry to the size of a shoe box (one will be the base, one the lid – roll the lid ever so slightly bigger). Line a large roasting tray with greaseproof paper, dust with flour, then add the smaller piece of pastry. Spread half of the mushroom stuffing onto the middle of the base to cover an area the same size as your turkey breast. Remove the cocktail sticks, then place the turkey breast on top and spread the remaining stuffing over the top packing it all in and smoothing it out so that the whole breast is covered.  Sprinkle with the crispy bacon and rosemary, then brush the edges of the pastry with beaten egg. Lay the second sheet of pastry over the top, gently mold it round the shape of the breast, pushing all the air out and seal together. Trim the edges  to around 4cm, then pull, twist, tuck and pinch in the pastry (like in the picture)., Brush the whole thing with beaten egg then all the hard work’s done. Leave it uncovered in the fridge overnight until you’re ready to cook. On Christmas day, cook at 180°/350°F/gas 4 for 50 to 60 minutes, or until risen, puffy and beautifully golden and the turkey is piping hot throughout. Remove from the oven and leave to cool for around 10 minutes before carving. Serve carved into 2.5cm with the gravy and all the usual. Christmas in a mouthful."
